SparkLAN

brad@Q2900M:~$ iw list
Wiphy phy1
	max # scan SSIDs: 16
	max scan IEs length: 195 bytes
	Coverage class: 0 (up to 0m)
	Device supports AP-side u-APSD.
	Supported Ciphers:
		* WEP40 (00-0f-ac:1)
		* WEP104 (00-0f-ac:5)
		* TKIP (00-0f-ac:2)
		* CCMP (00-0f-ac:4)
		* CMAC (00-0f-ac:6)
	Available Antennas: TX 0x7 RX 0x7
	Configured Antennas: TX 0x7 RX 0x7
	Supported interface modes:
		 * IBSS
		 * managed
		 * AP
		 * AP/VLAN
		 * monitor
		 * P2P-client
		 * P2P-GO
	Band 1:
		Capabilities: 0x19e3
			RX LDPC
			HT20/HT40
			Static SM Power Save
			RX HT20 SGI
			RX HT40 SGI
			TX STBC
			RX STBC 1-stream
			Max AMSDU length: 7935 bytes
			DSSS/CCK HT40
		Maximum RX AMPDU length 65535 bytes (exponent: 0x003)
		Minimum RX AMPDU time spacing: 8 usec (0x06)
		HT TX/RX MCS rate indexes supported: 0-15
		Bitrates (non-HT):
			* 1.0 Mbps
			* 2.0 Mbps
			* 5.5 Mbps
			* 11.0 Mbps
			* 6.0 Mbps
			* 9.0 Mbps
			* 12.0 Mbps
			* 18.0 Mbps
			* 24.0 Mbps
			* 36.0 Mbps
			* 48.0 Mbps
			* 54.0 Mbps
		Frequencies:
			* 2412 MHz [1] (27.0 dBm)
			* 2417 MHz [2] (27.0 dBm)
			* 2422 MHz [3] (27.0 dBm)
			* 2427 MHz [4] (27.0 dBm)
			* 2432 MHz [5] (27.0 dBm)
			* 2437 MHz [6] (27.0 dBm)
			* 2442 MHz [7] (27.0 dBm)
			* 2447 MHz [8] (27.0 dBm)
			* 2452 MHz [9] (27.0 dBm)
			* 2457 MHz [10] (27.0 dBm)
			* 2462 MHz [11] (27.0 dBm)
			* 2467 MHz [12] (disabled)
			* 2472 MHz [13] (disabled)
			* 2484 MHz [14] (disabled)
	Band 2:
		Capabilities: 0x19e3
			RX LDPC
			HT20/HT40
			Static SM Power Save
			RX HT20 SGI
			RX HT40 SGI
			TX STBC
			RX STBC 1-stream
			Max AMSDU length: 7935 bytes
			DSSS/CCK HT40
		Maximum RX AMPDU length 65535 bytes (exponent: 0x003)
		Minimum RX AMPDU time spacing: 8 usec (0x06)
		HT TX/RX MCS rate indexes supported: 0-15
		VHT Capabilities (0x338001b2):
			Max MPDU length: 11454
			Supported Channel Width: neither 160 nor 80+80
			RX LDPC
			short GI (80 MHz)
			TX STBC
			RX antenna pattern consistency
		VHT RX MCS set:
			1 streams: MCS 0-9
			2 streams: MCS 0-9
			3 streams: not supported
			4 streams: not supported
			5 streams: not supported
			6 streams: not supported
			7 streams: not supported
			8 streams: not supported
		VHT RX highest supported: 0 Mbps
		VHT TX MCS set:
			1 streams: MCS 0-9
			2 streams: MCS 0-9
			3 streams: not supported
			4 streams: not supported
			5 streams: not supported
			6 streams: not supported
			7 streams: not supported
			8 streams: not supported
		VHT TX highest supported: 0 Mbps
		Bitrates (non-HT):
			* 6.0 Mbps
			* 9.0 Mbps
			* 12.0 Mbps
			* 18.0 Mbps
			* 24.0 Mbps
			* 36.0 Mbps
			* 48.0 Mbps
			* 54.0 Mbps
		Frequencies:
			* 5180 MHz [36] (17.0 dBm)
			* 5200 MHz [40] (17.0 dBm)
			* 5220 MHz [44] (17.0 dBm)
			* 5240 MHz [48] (17.0 dBm)
			* 5260 MHz [52] (20.0 dBm) (no IR, radar detection)
			  DFS state: usable (for 4294776 sec)
			* 5280 MHz [56] (20.0 dBm) (no IR, radar detection)
			  DFS state: usable (for 4294776 sec)
			* 5300 MHz [60] (20.0 dBm) (no IR, radar detection)
			  DFS state: usable (for 4294776 sec)
			* 5320 MHz [64] (20.0 dBm) (no IR, radar detection)
			  DFS state: usable (for 4294776 sec)
			* 5500 MHz [100] (20.0 dBm) (no IR, radar detection)
			  DFS state: usable (for 4294776 sec)
			* 5520 MHz [104] (20.0 dBm) (no IR, radar detection)
			  DFS state: usable (for 4294776 sec)
			* 5540 MHz [108] (20.0 dBm) (no IR, radar detection)
			  DFS state: usable (for 4294776 sec)
			* 5560 MHz [112] (20.0 dBm) (no IR, radar detection)
			  DFS state: usable (for 4294776 sec)
			* 5580 MHz [116] (20.0 dBm) (no IR, radar detection)
			  DFS state: usable (for 4294776 sec)
			* 5600 MHz [120] (disabled)
			* 5620 MHz [124] (disabled)
			* 5640 MHz [128] (disabled)
			* 5660 MHz [132] (20.0 dBm) (no IR, radar detection)
			  DFS state: usable (for 4294776 sec)
			* 5680 MHz [136] (20.0 dBm) (no IR, radar detection)
			  DFS state: usable (for 4294776 sec)
			* 5700 MHz [140] (20.0 dBm) (no IR, radar detection)
			  DFS state: usable (for 4294776 sec)
			* 5745 MHz [149] (30.0 dBm)
			* 5765 MHz [153] (30.0 dBm)
			* 5785 MHz [157] (30.0 dBm)
			* 5805 MHz [161] (30.0 dBm)
			* 5825 MHz [165] (30.0 dBm)
	Supported commands:
		 * new_interface
		 * set_interface
		 * new_key
		 * start_ap
		 * new_station
		 * new_mpath
		 * set_mesh_config
		 * set_bss
		 * authenticate
		 * associate
		 * deauthenticate
		 * disassociate
		 * join_ibss
		 * join_mesh
		 * remain_on_channel
		 * set_tx_bitrate_mask
		 * frame
		 * frame_wait_cancel
		 * set_wiphy_netns
		 * set_channel
		 * set_wds_peer
		 * probe_client
		 * set_noack_map
		 * register_beacons
		 * start_p2p_device
		 * set_mcast_rate
		 * Unknown command (104)
		 * connect
		 * disconnect
	Supported TX frame types:
		 * IBSS: 0x00 0x10 0x20 0x30 0x40 0x50 0x60 0x70 0x80 0x90 0xa0 0xb0 0xc0 0xd0 0xe0 0xf0
		 * managed: 0x00 0x10 0x20 0x30 0x40 0x50 0x60 0x70 0x80 0x90 0xa0 0xb0 0xc0 0xd0 0xe0 0xf0
		 * AP: 0x00 0x10 0x20 0x30 0x40 0x50 0x60 0x70 0x80 0x90 0xa0 0xb0 0xc0 0xd0 0xe0 0xf0
		 * AP/VLAN: 0x00 0x10 0x20 0x30 0x40 0x50 0x60 0x70 0x80 0x90 0xa0 0xb0 0xc0 0xd0 0xe0 0xf0
		 * mesh point: 0x00 0x10 0x20 0x30 0x40 0x50 0x60 0x70 0x80 0x90 0xa0 0xb0 0xc0 0xd0 0xe0 0xf0
		 * P2P-client: 0x00 0x10 0x20 0x30 0x40 0x50 0x60 0x70 0x80 0x90 0xa0 0xb0 0xc0 0xd0 0xe0 0xf0
		 * P2P-GO: 0x00 0x10 0x20 0x30 0x40 0x50 0x60 0x70 0x80 0x90 0xa0 0xb0 0xc0 0xd0 0xe0 0xf0
		 * P2P-device: 0x00 0x10 0x20 0x30 0x40 0x50 0x60 0x70 0x80 0x90 0xa0 0xb0 0xc0 0xd0 0xe0 0xf0
	Supported RX frame types:
		 * IBSS: 0x40 0xb0 0xc0 0xd0
		 * managed: 0x40 0xd0
		 * AP: 0x00 0x20 0x40 0xa0 0xb0 0xc0 0xd0
		 * AP/VLAN: 0x00 0x20 0x40 0xa0 0xb0 0xc0 0xd0
		 * mesh point: 0xb0 0xc0 0xd0
		 * P2P-client: 0x40 0xd0
		 * P2P-GO: 0x00 0x20 0x40 0xa0 0xb0 0xc0 0xd0
		 * P2P-device: 0x40 0xd0
	software interface modes (can always be added):
		 * AP/VLAN
		 * monitor
	valid interface combinations:
		 * #{ managed, P2P-client } <= 8, #{ P2P-GO } <= 3, #{ AP } <= 7,
		   total <= 8, #channels <= 1, STA/AP BI must match
	HT Capability overrides:
		 * MCS: ff ff ff ff ff ff ff ff ff ff
		 * maximum A-MSDU length
		 * supported channel width
		 * short GI for 40 MHz
		 * max A-MPDU length exponent
		 * min MPDU start spacing
	Device supports TX status socket option.
	Device supports HT-IBSS.
	Device supports scan flush.
Wiphy phy0
	max # scan SSIDs: 4
	max scan IEs length: 2257 bytes
	Coverage class: 0 (up to 0m)
	Device supports RSN-IBSS.
	Device supports AP-side u-APSD.
	Device supports T-DLS.
	Supported Ciphers:
		* WEP40 (00-0f-ac:1)
		* WEP104 (00-0f-ac:5)
		* TKIP (00-0f-ac:2)
		* CCMP (00-0f-ac:4)
		* CMAC (00-0f-ac:6)
	Available Antennas: TX 0x7 RX 0x7
	Configured Antennas: TX 0x7 RX 0x7
	Supported interface modes:
		 * IBSS
		 * managed
		 * AP
		 * AP/VLAN
		 * WDS
		 * monitor
		 * mesh point
		 * P2P-client
		 * P2P-GO
	Band 1:
		Capabilities: 0x11ef
			RX LDPC
			HT20/HT40
			SM Power Save disabled
			RX HT20 SGI
			RX HT40 SGI
			TX STBC
			RX STBC 1-stream
			Max AMSDU length: 3839 bytes
			DSSS/CCK HT40
		Maximum RX AMPDU length 65535 bytes (exponent: 0x003)
		Minimum RX AMPDU time spacing: 8 usec (0x06)
		HT TX/RX MCS rate indexes supported: 0-23
		Bitrates (non-HT):
			* 1.0 Mbps
			* 2.0 Mbps (short preamble supported)
			* 5.5 Mbps (short preamble supported)
			* 11.0 Mbps (short preamble supported)
			* 6.0 Mbps
			* 9.0 Mbps
			* 12.0 Mbps
			* 18.0 Mbps
			* 24.0 Mbps
			* 36.0 Mbps
			* 48.0 Mbps
			* 54.0 Mbps
		Frequencies:
			* 2412 MHz [1] (15.0 dBm)
			* 2417 MHz [2] (15.0 dBm)
			* 2422 MHz [3] (15.0 dBm)
			* 2427 MHz [4] (15.0 dBm)
			* 2432 MHz [5] (15.0 dBm)
			* 2437 MHz [6] (15.0 dBm)
			* 2442 MHz [7] (15.0 dBm)
			* 2447 MHz [8] (15.0 dBm)
			* 2452 MHz [9] (15.0 dBm)
			* 2457 MHz [10] (15.0 dBm)
			* 2462 MHz [11] (15.0 dBm)
			* 2467 MHz [12] (disabled)
			* 2472 MHz [13] (disabled)
			* 2484 MHz [14] (disabled)
	Band 2:
		Capabilities: 0x11ef
			RX LDPC
			HT20/HT40
			SM Power Save disabled
			RX HT20 SGI
			RX HT40 SGI
			TX STBC
			RX STBC 1-stream
			Max AMSDU length: 3839 bytes
			DSSS/CCK HT40
		Maximum RX AMPDU length 65535 bytes (exponent: 0x003)
		Minimum RX AMPDU time spacing: 8 usec (0x06)
		HT TX/RX MCS rate indexes supported: 0-23
		Bitrates (non-HT):
			* 6.0 Mbps
			* 9.0 Mbps
			* 12.0 Mbps
			* 18.0 Mbps
			* 24.0 Mbps
			* 36.0 Mbps
			* 48.0 Mbps
			* 54.0 Mbps
		Frequencies:
			* 5180 MHz [36] (15.0 dBm) (no IR)
			* 5200 MHz [40] (15.0 dBm) (no IR)
			* 5220 MHz [44] (15.0 dBm) (no IR)
			* 5240 MHz [48] (15.0 dBm) (no IR)
			* 5260 MHz [52] (16.0 dBm) (no IR, radar detection)
			  DFS state: usable (for 96 sec)
			* 5280 MHz [56] (16.0 dBm) (no IR, radar detection)
			  DFS state: usable (for 96 sec)
			* 5300 MHz [60] (16.0 dBm) (no IR, radar detection)
			  DFS state: usable (for 96 sec)
			* 5320 MHz [64] (16.0 dBm) (no IR, radar detection)
			  DFS state: usable (for 96 sec)
			* 5500 MHz [100] (disabled)
			* 5520 MHz [104] (disabled)
			* 5540 MHz [108] (disabled)
			* 5560 MHz [112] (disabled)
			* 5580 MHz [116] (disabled)
			* 5600 MHz [120] (disabled)
			* 5620 MHz [124] (disabled)
			* 5640 MHz [128] (disabled)
			* 5660 MHz [132] (disabled)
			* 5680 MHz [136] (disabled)
			* 5700 MHz [140] (disabled)
			* 5745 MHz [149] (20.0 dBm) (no IR)
			* 5765 MHz [153] (20.0 dBm) (no IR)
			* 5785 MHz [157] (20.0 dBm) (no IR)
			* 5805 MHz [161] (20.0 dBm) (no IR)
			* 5825 MHz [165] (20.0 dBm) (no IR)
	Supported commands:
		 * new_interface
		 * set_interface
		 * new_key
		 * start_ap
		 * new_station
		 * new_mpath
		 * set_mesh_config
		 * set_bss
		 * authenticate
		 * associate
		 * deauthenticate
		 * disassociate
		 * join_ibss
		 * join_mesh
		 * remain_on_channel
		 * set_tx_bitrate_mask
		 * frame
		 * frame_wait_cancel
		 * set_wiphy_netns
		 * set_channel
		 * set_wds_peer
		 * tdls_mgmt
		 * tdls_oper
		 * probe_client
		 * set_noack_map
		 * register_beacons
		 * start_p2p_device
		 * set_mcast_rate
		 * Unknown command (104)
		 * connect
		 * disconnect
	Supported TX frame types:
		 * IBSS: 0x00 0x10 0x20 0x30 0x40 0x50 0x60 0x70 0x80 0x90 0xa0 0xb0 0xc0 0xd0 0xe0 0xf0
		 * managed: 0x00 0x10 0x20 0x30 0x40 0x50 0x60 0x70 0x80 0x90 0xa0 0xb0 0xc0 0xd0 0xe0 0xf0
		 * AP: 0x00 0x10 0x20 0x30 0x40 0x50 0x60 0x70 0x80 0x90 0xa0 0xb0 0xc0 0xd0 0xe0 0xf0
		 * AP/VLAN: 0x00 0x10 0x20 0x30 0x40 0x50 0x60 0x70 0x80 0x90 0xa0 0xb0 0xc0 0xd0 0xe0 0xf0
		 * mesh point: 0x00 0x10 0x20 0x30 0x40 0x50 0x60 0x70 0x80 0x90 0xa0 0xb0 0xc0 0xd0 0xe0 0xf0
		 * P2P-client: 0x00 0x10 0x20 0x30 0x40 0x50 0x60 0x70 0x80 0x90 0xa0 0xb0 0xc0 0xd0 0xe0 0xf0
		 * P2P-GO: 0x00 0x10 0x20 0x30 0x40 0x50 0x60 0x70 0x80 0x90 0xa0 0xb0 0xc0 0xd0 0xe0 0xf0
		 * P2P-device: 0x00 0x10 0x20 0x30 0x40 0x50 0x60 0x70 0x80 0x90 0xa0 0xb0 0xc0 0xd0 0xe0 0xf0
	Supported RX frame types:
		 * IBSS: 0x40 0xb0 0xc0 0xd0
		 * managed: 0x40 0xd0
		 * AP: 0x00 0x20 0x40 0xa0 0xb0 0xc0 0xd0
		 * AP/VLAN: 0x00 0x20 0x40 0xa0 0xb0 0xc0 0xd0
		 * mesh point: 0xb0 0xc0 0xd0
		 * P2P-client: 0x40 0xd0
		 * P2P-GO: 0x00 0x20 0x40 0xa0 0xb0 0xc0 0xd0
		 * P2P-device: 0x40 0xd0
	software interface modes (can always be added):
		 * AP/VLAN
		 * monitor
	valid interface combinations:
		 * #{ managed } <= 2048, #{ AP, mesh point } <= 8, #{ P2P-client, P2P-GO } <= 1,
		   total <= 2048, #channels <= 1, STA/AP BI must match
		 * #{ WDS } <= 2048,
		   total <= 2048, #channels <= 1, STA/AP BI must match
	HT Capability overrides:
		 * MCS: ff ff ff ff ff ff ff ff ff ff
		 * maximum A-MSDU length
		 * supported channel width
		 * short GI for 40 MHz
		 * max A-MPDU length exponent
		 * min MPDU start spacing
	Device supports TX status socket option.
	Device supports HT-IBSS.
	Device supports low priority scan.
	Device supports scan flush.
	Device supports AP scan.


brad@Q2900M:~$ sudo lspci -nn
00:00.0 Host bridge [0600]: Intel Corporation Atom Processor Z36xxx/Z37xxx Series SoC Transaction Register [8086:0f00] (rev 0e)
00:02.0 VGA compatible controller [0300]: Intel Corporation Atom Processor Z36xxx/Z37xxx Series Graphics & Display [8086:0f31] (rev 0e)
00:13.0 SATA controller [0106]: Intel Corporation Atom Processor E3800 Series SATA AHCI Controller [8086:0f23] (rev 0e)
00:14.0 USB controller [0c03]: Intel Corporation Atom Processor Z36xxx/Z37xxx Series USB xHCI [8086:0f35] (rev 0e)
00:1a.0 Encryption controller [1080]: Intel Corporation Atom Processor Z36xxx/Z37xxx Series Trusted Execution Engine [8086:0f18] (rev 0e)
00:1c.0 PCI bridge [0604]: Intel Corporation Atom Processor E3800 Series PCI Express Root Port 1 [8086:0f48] (rev 0e)
00:1c.1 PCI bridge [0604]: Intel Corporation Atom Processor E3800 Series PCI Express Root Port 2 [8086:0f4a] (rev 0e)
00:1c.2 PCI bridge [0604]: Intel Corporation Atom Processor E3800 Series PCI Express Root Port 3 [8086:0f4c] (rev 0e)
00:1c.3 PCI bridge [0604]: Intel Corporation Atom Processor E3800 Series PCI Express Root Port 4 [8086:0f4e] (rev 0e)
00:1f.0 ISA bridge [0601]: Intel Corporation Atom Processor Z36xxx/Z37xxx Series Power Control Unit [8086:0f1c] (rev 0e)
00:1f.3 SMBus [0c05]: Intel Corporation Atom Processor E3800 Series SMBus Controller [8086:0f12] (rev 0e)
01:00.0 Network controller [0280]: Qualcomm Atheros QCA986x/988x 802.11ac Wireless Network Adapter [168c:003c]
02:00.0 PCI bridge [0604]: Integrated Device Technology, Inc. [IDT] PES12N3A PCI Express Switch [111d:8018] (rev 0e)
03:02.0 PCI bridge [0604]: Integrated Device Technology, Inc. [IDT] PES12N3A PCI Express Switch [111d:8018] (rev 0e)
03:04.0 PCI bridge [0604]: Integrated Device Technology, Inc. [IDT] PES12N3A PCI Express Switch [111d:8018] (rev 0e)
04:00.0 Ethernet controller [0200]: Intel Corporation 82575GB Gigabit Network Connection [8086:10d6] (rev 02)
04:00.1 Ethernet controller [0200]: Intel Corporation 82575GB Gigabit Network Connection [8086:10d6] (rev 02)
05:00.0 Ethernet controller [0200]: Intel Corporation 82575GB Gigabit Network Connection [8086:10d6] (rev 02)
05:00.1 Ethernet controller [0200]: Intel Corporation 82575GB Gigabit Network Connection [8086:10d6] (rev 02)
06:00.0 Network controller [0280]: Qualcomm Atheros AR93xx Wireless Network Adapter [168c:0030] (rev 01)
07:00.0 Ethernet controller [0200]: Realtek Semiconductor Co., Ltd. RTL8111/8168/8411 PCI Express Gigabit Ethernet Controller [10ec:8168] (rev 11)


brad@Q2900M:~$ sudo lspci -nnvv
00:00.0 Host bridge [0600]: Intel Corporation Atom Processor Z36xxx/Z37xxx Series SoC Transaction Register [8086:0f00] (rev 0e)
	Subsystem: ASRock Incorporation Device [1849:0f31]
	Control: I/O+ Mem+ BusMaster+ SpecCycle- MemWINV- VGASnoop- ParErr- Stepping- SERR- FastB2B- DisINTx-
	Status: Cap- 66MHz- UDF- FastB2B- ParErr- DEVSEL=fast >TAbort- <TAbort- <MAbort- >SERR- <PERR- INTx-
	Latency: 0
	Kernel driver in use: iosf_mbi_pci

00:02.0 VGA compatible controller [0300]: Intel Corporation Atom Processor Z36xxx/Z37xxx Series Graphics & Display [8086:0f31] (rev 0e) (prog-if 00 [VGA controller])
	Subsystem: ASRock Incorporation Device [1849:0f31]
	Control: I/O+ Mem+ BusMaster+ SpecCycle- MemWINV- VGASnoop- ParErr- Stepping- SERR- FastB2B- DisINTx+
	Status: Cap+ 66MHz- UDF- FastB2B- ParErr- DEVSEL=fast >TAbort- <TAbort- <MAbort- >SERR- <PERR- INTx-
	Latency: 0
	Interrupt: pin A routed to IRQ 117
	Region 0: Memory at d0000000 (32-bit, non-prefetchable) [size=4M]
	Region 2: Memory at c0000000 (32-bit, prefetchable) [size=256M]
	Region 4: I/O ports at f080 [size=8]
	Expansion ROM at <unassigned> [disabled]
	Capabilities: [d0] Power Management version 2
		Flags: PMEClk- DSI+ D1- D2- AuxCurrent=0mA PME(D0-,D1-,D2-,D3hot-,D3cold-)
		Status: D0 NoSoftRst- PME-Enable- DSel=0 DScale=0 PME-
	Capabilities: [90] MSI: Enable+ Count=1/1 Maskable- 64bit-
		Address: fee0f00c  Data: 41b2
	Capabilities: [b0] Vendor Specific Information: Len=07 <?>
	Kernel driver in use: i915

00:13.0 SATA controller [0106]: Intel Corporation Atom Processor E3800 Series SATA AHCI Controller [8086:0f23] (rev 0e) (prog-if 01 [AHCI 1.0])
	Subsystem: ASRock Incorporation Device [1849:0f23]
	Control: I/O+ Mem+ BusMaster+ SpecCycle- MemWINV- VGASnoop- ParErr- Stepping- SERR- FastB2B- DisINTx+
	Status: Cap+ 66MHz+ UDF- FastB2B+ ParErr- DEVSEL=medium >TAbort- <TAbort- <MAbort- >SERR- <PERR- INTx-
	Latency: 0
	Interrupt: pin A routed to IRQ 106
	Region 0: I/O ports at f070 [size=8]
	Region 1: I/O ports at f060 [size=4]
	Region 2: I/O ports at f050 [size=8]
	Region 3: I/O ports at f040 [size=4]
	Region 4: I/O ports at f020 [size=32]
	Region 5: Memory at d1612000 (32-bit, non-prefetchable) [size=2K]
	Capabilities: [80] MSI: Enable+ Count=1/1 Maskable- 64bit-
		Address: fee0300c  Data: 41c1
	Capabilities: [70] Power Management version 3
		Flags: PMEClk- DSI- D1- D2- AuxCurrent=0mA PME(D0-,D1-,D2-,D3hot+,D3cold-)
		Status: D0 NoSoftRst+ PME-Enable- DSel=0 DScale=0 PME-
	Capabilities: [a8] SATA HBA v1.0 BAR4 Offset=00000004
	Kernel driver in use: ahci

00:14.0 USB controller [0c03]: Intel Corporation Atom Processor Z36xxx/Z37xxx Series USB xHCI [8086:0f35] (rev 0e) (prog-if 30 [XHCI])
	Subsystem: ASRock Incorporation Device [1849:0f35]
	Control: I/O- Mem+ BusMaster+ SpecCycle- MemWINV- VGASnoop- ParErr- Stepping- SERR- FastB2B- DisINTx+
	Status: Cap+ 66MHz- UDF- FastB2B+ ParErr- DEVSEL=medium >TAbort- <TAbort- <MAbort- >SERR- <PERR- INTx-
	Latency: 0
	Interrupt: pin A routed to IRQ 105
	Region 0: Memory at d1600000 (64-bit, non-prefetchable) [size=64K]
	Capabilities: [70] Power Management version 2
		Flags: PMEClk- DSI- D1- D2- AuxCurrent=375mA PME(D0-,D1-,D2-,D3hot+,D3cold+)
		Status: D0 NoSoftRst+ PME-Enable- DSel=0 DScale=0 PME-
	Capabilities: [80] MSI: Enable+ Count=1/8 Maskable- 64bit+
		Address: 00000000fee0c00c  Data: 41b1
	Kernel driver in use: xhci_hcd

00:1a.0 Encryption controller [1080]: Intel Corporation Atom Processor Z36xxx/Z37xxx Series Trusted Execution Engine [8086:0f18] (rev 0e)
	Subsystem: ASRock Incorporation Device [1849:0f18]
	Control: I/O- Mem+ BusMaster+ SpecCycle- MemWINV- VGASnoop- ParErr- Stepping- SERR+ FastB2B- DisINTx+
	Status: Cap+ 66MHz- UDF- FastB2B- ParErr- DEVSEL=fast >TAbort- <TAbort- <MAbort- >SERR- <PERR- INTx-
	Latency: 0, Cache Line Size: 64 bytes
	Interrupt: pin A routed to IRQ 145
	Region 0: Memory at d1300000 (32-bit, non-prefetchable) [size=1M]
	Region 1: Memory at d0f00000 (32-bit, non-prefetchable) [size=1M]
	Capabilities: [80] Power Management version 3
		Flags: PMEClk- DSI- D1- D2- AuxCurrent=0mA PME(D0+,D1-,D2-,D3hot+,D3cold-)
		Status: D0 NoSoftRst+ PME-Enable- DSel=0 DScale=0 PME-
	Capabilities: [a0] MSI: Enable+ Count=1/1 Maskable- 64bit-
		Address: fee0f00c  Data: 4128
	Kernel driver in use: mei_txe

00:1c.0 PCI bridge [0604]: Intel Corporation Atom Processor E3800 Series PCI Express Root Port 1 [8086:0f48] (rev 0e) (prog-if 00 [Normal decode])
	Control: I/O+ Mem+ BusMaster+ SpecCycle- MemWINV- VGASnoop- ParErr- Stepping- SERR- FastB2B- DisINTx-
	Status: Cap+ 66MHz- UDF- FastB2B- ParErr- DEVSEL=fast >TAbort- <TAbort- <MAbort- >SERR- <PERR- INTx-
	Latency: 0, Cache Line Size: 64 bytes
	Bus: primary=00, secondary=01, subordinate=01, sec-latency=0
	I/O behind bridge: 00001000-00001fff
	Memory behind bridge: d1000000-d12fffff
	Secondary status: 66MHz- FastB2B- ParErr- DEVSEL=fast >TAbort- <TAbort- <MAbort+ <SERR- <PERR-
	BridgeCtl: Parity- SERR- NoISA- VGA- MAbort- >Reset- FastB2B-
		PriDiscTmr- SecDiscTmr- DiscTmrStat- DiscTmrSERREn-
	Capabilities: [40] Express (v2) Root Port (Slot+), MSI 00
		DevCap:	MaxPayload 128 bytes, PhantFunc 0
			ExtTag- RBE+
		DevCtl:	Report errors: Correctable- Non-Fatal- Fatal- Unsupported-
			RlxdOrd- ExtTag- PhantFunc- AuxPwr- NoSnoop-
			MaxPayload 128 bytes, MaxReadReq 128 bytes
		DevSta:	CorrErr+ UncorrErr- FatalErr- UnsuppReq- AuxPwr+ TransPend-
		LnkCap:	Port #1, Speed 5GT/s, Width x1, ASPM L0s L1, Exit Latency L0s <512ns, L1 <4us
			ClockPM- Surprise- LLActRep+ BwNot+
		LnkCtl:	ASPM Disabled; RCB 64 bytes Disabled- CommClk+
			ExtSynch- ClockPM- AutWidDis- BWInt- AutBWInt-
		LnkSta:	Speed 2.5GT/s, Width x1, TrErr- Train- SlotClk+ DLActive+ BWMgmt+ ABWMgmt-
		SltCap:	AttnBtn- PwrCtrl- MRL- AttnInd- PwrInd- HotPlug+ Surprise+
			Slot #0, PowerLimit 10.000W; Interlock- NoCompl+
		SltCtl:	Enable: AttnBtn- PwrFlt- MRL- PresDet- CmdCplt- HPIrq- LinkChg-
			Control: AttnInd Unknown, PwrInd Unknown, Power- Interlock-
		SltSta:	Status: AttnBtn- PowerFlt- MRL- CmdCplt- PresDet+ Interlock-
			Changed: MRL- PresDet- LinkState-
		RootCtl: ErrCorrectable- ErrNon-Fatal- ErrFatal- PMEIntEna- CRSVisible-
		RootCap: CRSVisible-
		RootSta: PME ReqID 0000, PMEStatus- PMEPending-
		DevCap2: Completion Timeout: Range BC, TimeoutDis+, LTR-, OBFF Not Supported ARIFwd-
		DevCtl2: Completion Timeout: 50us to 50ms, TimeoutDis-, LTR-, OBFF Disabled ARIFwd-
		LnkCtl2: Target Link Speed: 5GT/s, EnterCompliance- SpeedDis-
			 Transmit Margin: Normal Operating Range, EnterModifiedCompliance- ComplianceSOS-
			 Compliance De-emphasis: -6dB
		LnkSta2: Current De-emphasis Level: -3.5dB, EqualizationComplete-, EqualizationPhase1-
			 EqualizationPhase2-, EqualizationPhase3-, LinkEqualizationRequest-
	Capabilities: [80] MSI: Enable- Count=1/1 Maskable- 64bit-
		Address: 00000000  Data: 0000
	Capabilities: [90] Subsystem: ASRock Incorporation Device [1849:0f48]
	Capabilities: [a0] Power Management version 3
		Flags: PMEClk- DSI- D1- D2- AuxCurrent=0mA PME(D0+,D1-,D2-,D3hot+,D3cold+)
		Status: D0 NoSoftRst- PME-Enable- DSel=0 DScale=0 PME-
	Kernel driver in use: pcieport

00:1c.1 PCI bridge [0604]: Intel Corporation Atom Processor E3800 Series PCI Express Root Port 2 [8086:0f4a] (rev 0e) (prog-if 00 [Normal decode])
	Control: I/O+ Mem+ BusMaster+ SpecCycle- MemWINV- VGASnoop- ParErr- Stepping- SERR- FastB2B- DisINTx-
	Status: Cap+ 66MHz- UDF- FastB2B- ParErr- DEVSEL=fast >TAbort- <TAbort- <MAbort- >SERR- <PERR- INTx-
	Latency: 0, Cache Line Size: 64 bytes
	Bus: primary=00, secondary=02, subordinate=05, sec-latency=0
	I/O behind bridge: 0000c000-0000dfff
	Memory behind bridge: d0400000-d0efffff
	Secondary status: 66MHz- FastB2B- ParErr- DEVSEL=fast >TAbort- <TAbort- <MAbort+ <SERR- <PERR-
	BridgeCtl: Parity- SERR- NoISA- VGA- MAbort- >Reset- FastB2B-
		PriDiscTmr- SecDiscTmr- DiscTmrStat- DiscTmrSERREn-
	Capabilities: [40] Express (v2) Root Port (Slot+), MSI 00
		DevCap:	MaxPayload 128 bytes, PhantFunc 0
			ExtTag- RBE+
		DevCtl:	Report errors: Correctable- Non-Fatal- Fatal- Unsupported-
			RlxdOrd- ExtTag- PhantFunc- AuxPwr- NoSnoop-
			MaxPayload 128 bytes, MaxReadReq 128 bytes
		DevSta:	CorrErr+ UncorrErr- FatalErr- UnsuppReq- AuxPwr+ TransPend-
		LnkCap:	Port #2, Speed 5GT/s, Width x1, ASPM L0s L1, Exit Latency L0s <512ns, L1 <4us
			ClockPM- Surprise- LLActRep+ BwNot+
		LnkCtl:	ASPM Disabled; RCB 64 bytes Disabled- CommClk+
			ExtSynch- ClockPM- AutWidDis- BWInt- AutBWInt-
		LnkSta:	Speed 2.5GT/s, Width x1, TrErr- Train- SlotClk+ DLActive+ BWMgmt+ ABWMgmt-
		SltCap:	AttnBtn- PwrCtrl- MRL- AttnInd- PwrInd- HotPlug+ Surprise+
			Slot #1, PowerLimit 10.000W; Interlock- NoCompl+
		SltCtl:	Enable: AttnBtn- PwrFlt- MRL- PresDet- CmdCplt- HPIrq- LinkChg-
			Control: AttnInd Unknown, PwrInd Unknown, Power- Interlock-
		SltSta:	Status: AttnBtn- PowerFlt- MRL- CmdCplt- PresDet+ Interlock-
			Changed: MRL- PresDet- LinkState-
		RootCtl: ErrCorrectable- ErrNon-Fatal- ErrFatal- PMEIntEna- CRSVisible-
		RootCap: CRSVisible-
		RootSta: PME ReqID 0000, PMEStatus- PMEPending-
		DevCap2: Completion Timeout: Range BC, TimeoutDis+, LTR-, OBFF Not Supported ARIFwd-
		DevCtl2: Completion Timeout: 50us to 50ms, TimeoutDis-, LTR-, OBFF Disabled ARIFwd-
		LnkCtl2: Target Link Speed: 5GT/s, EnterCompliance- SpeedDis-
			 Transmit Margin: Normal Operating Range, EnterModifiedCompliance- ComplianceSOS-
			 Compliance De-emphasis: -6dB
		LnkSta2: Current De-emphasis Level: -3.5dB, EqualizationComplete-, EqualizationPhase1-
			 EqualizationPhase2-, EqualizationPhase3-, LinkEqualizationRequest-
	Capabilities: [80] MSI: Enable- Count=1/1 Maskable- 64bit-
		Address: 00000000  Data: 0000
	Capabilities: [90] Subsystem: ASRock Incorporation Device [1849:0f4a]
	Capabilities: [a0] Power Management version 3
		Flags: PMEClk- DSI- D1- D2- AuxCurrent=0mA PME(D0+,D1-,D2-,D3hot+,D3cold+)
		Status: D0 NoSoftRst- PME-Enable- DSel=0 DScale=0 PME-
	Kernel driver in use: pcieport

00:1c.2 PCI bridge [0604]: Intel Corporation Atom Processor E3800 Series PCI Express Root Port 3 [8086:0f4c] (rev 0e) (prog-if 00 [Normal decode])
	Control: I/O+ Mem+ BusMaster+ SpecCycle- MemWINV- VGASnoop- ParErr- Stepping- SERR- FastB2B- DisINTx-
	Status: Cap+ 66MHz- UDF- FastB2B- ParErr- DEVSEL=fast >TAbort- <TAbort- <MAbort- >SERR- <PERR- INTx-
	Latency: 0, Cache Line Size: 64 bytes
	Bus: primary=00, secondary=06, subordinate=06, sec-latency=0
	I/O behind bridge: 00002000-00002fff
	Memory behind bridge: d1500000-d15fffff
	Secondary status: 66MHz- FastB2B- ParErr- DEVSEL=fast >TAbort- <TAbort- <MAbort+ <SERR- <PERR-
	BridgeCtl: Parity- SERR- NoISA- VGA- MAbort- >Reset- FastB2B-
		PriDiscTmr- SecDiscTmr- DiscTmrStat- DiscTmrSERREn-
	Capabilities: [40] Express (v2) Root Port (Slot+), MSI 00
		DevCap:	MaxPayload 128 bytes, PhantFunc 0
			ExtTag- RBE+
		DevCtl:	Report errors: Correctable- Non-Fatal- Fatal- Unsupported-
			RlxdOrd- ExtTag- PhantFunc- AuxPwr- NoSnoop-
			MaxPayload 128 bytes, MaxReadReq 128 bytes
		DevSta:	CorrErr+ UncorrErr- FatalErr- UnsuppReq- AuxPwr+ TransPend-
		LnkCap:	Port #3, Speed 5GT/s, Width x1, ASPM L0s L1, Exit Latency L0s <512ns, L1 <4us
			ClockPM- Surprise- LLActRep+ BwNot+
		LnkCtl:	ASPM Disabled; RCB 64 bytes Disabled- CommClk+
			ExtSynch- ClockPM- AutWidDis- BWInt- AutBWInt-
		LnkSta:	Speed 2.5GT/s, Width x1, TrErr- Train- SlotClk+ DLActive+ BWMgmt+ ABWMgmt-
		SltCap:	AttnBtn- PwrCtrl- MRL- AttnInd- PwrInd- HotPlug+ Surprise+
			Slot #2, PowerLimit 10.000W; Interlock- NoCompl+
		SltCtl:	Enable: AttnBtn- PwrFlt- MRL- PresDet- CmdCplt- HPIrq- LinkChg-
			Control: AttnInd Unknown, PwrInd Unknown, Power- Interlock-
		SltSta:	Status: AttnBtn- PowerFlt- MRL- CmdCplt- PresDet+ Interlock-
			Changed: MRL- PresDet- LinkState-
		RootCtl: ErrCorrectable- ErrNon-Fatal- ErrFatal- PMEIntEna- CRSVisible-
		RootCap: CRSVisible-
		RootSta: PME ReqID 0000, PMEStatus- PMEPending-
		DevCap2: Completion Timeout: Range BC, TimeoutDis+, LTR-, OBFF Not Supported ARIFwd-
		DevCtl2: Completion Timeout: 50us to 50ms, TimeoutDis-, LTR-, OBFF Disabled ARIFwd-
		LnkCtl2: Target Link Speed: 5GT/s, EnterCompliance- SpeedDis-
			 Transmit Margin: Normal Operating Range, EnterModifiedCompliance- ComplianceSOS-
			 Compliance De-emphasis: -6dB
		LnkSta2: Current De-emphasis Level: -3.5dB, EqualizationComplete-, EqualizationPhase1-
			 EqualizationPhase2-, EqualizationPhase3-, LinkEqualizationRequest-
	Capabilities: [80] MSI: Enable- Count=1/1 Maskable- 64bit-
		Address: 00000000  Data: 0000
	Capabilities: [90] Subsystem: ASRock Incorporation Device [1849:0f4c]
	Capabilities: [a0] Power Management version 3
		Flags: PMEClk- DSI- D1- D2- AuxCurrent=0mA PME(D0+,D1-,D2-,D3hot+,D3cold+)
		Status: D0 NoSoftRst- PME-Enable- DSel=0 DScale=0 PME-
	Kernel driver in use: pcieport

00:1c.3 PCI bridge [0604]: Intel Corporation Atom Processor E3800 Series PCI Express Root Port 4 [8086:0f4e] (rev 0e) (prog-if 00 [Normal decode])
	Control: I/O+ Mem+ BusMaster+ SpecCycle- MemWINV- VGASnoop- ParErr- Stepping- SERR- FastB2B- DisINTx-
	Status: Cap+ 66MHz- UDF- FastB2B- ParErr- DEVSEL=fast >TAbort- <TAbort- <MAbort- >SERR- <PERR- INTx-
	Latency: 0, Cache Line Size: 64 bytes
	Bus: primary=00, secondary=07, subordinate=07, sec-latency=0
	I/O behind bridge: 0000e000-0000efff
	Memory behind bridge: d1400000-d14fffff
	Secondary status: 66MHz- FastB2B- ParErr- DEVSEL=fast >TAbort- <TAbort- <MAbort+ <SERR- <PERR-
	BridgeCtl: Parity- SERR- NoISA- VGA- MAbort- >Reset- FastB2B-
		PriDiscTmr- SecDiscTmr- DiscTmrStat- DiscTmrSERREn-
	Capabilities: [40] Express (v2) Root Port (Slot+), MSI 00
		DevCap:	MaxPayload 128 bytes, PhantFunc 0
			ExtTag- RBE+
		DevCtl:	Report errors: Correctable- Non-Fatal- Fatal- Unsupported-
			RlxdOrd- ExtTag- PhantFunc- AuxPwr- NoSnoop-
			MaxPayload 128 bytes, MaxReadReq 128 bytes
		DevSta:	CorrErr+ UncorrErr+ FatalErr- UnsuppReq+ AuxPwr+ TransPend-
		LnkCap:	Port #4, Speed 5GT/s, Width x1, ASPM L0s L1, Exit Latency L0s <512ns, L1 <4us
			ClockPM- Surprise- LLActRep+ BwNot+
		LnkCtl:	ASPM Disabled; RCB 64 bytes Disabled- CommClk+
			ExtSynch- ClockPM- AutWidDis- BWInt- AutBWInt-
		LnkSta:	Speed 2.5GT/s, Width x1, TrErr- Train- SlotClk+ DLActive+ BWMgmt+ ABWMgmt-
		SltCap:	AttnBtn- PwrCtrl- MRL- AttnInd- PwrInd- HotPlug+ Surprise+
			Slot #3, PowerLimit 10.000W; Interlock- NoCompl+
		SltCtl:	Enable: AttnBtn- PwrFlt- MRL- PresDet- CmdCplt- HPIrq- LinkChg-
			Control: AttnInd Unknown, PwrInd Unknown, Power- Interlock-
		SltSta:	Status: AttnBtn- PowerFlt- MRL- CmdCplt- PresDet+ Interlock-
			Changed: MRL- PresDet- LinkState-
		RootCtl: ErrCorrectable- ErrNon-Fatal- ErrFatal- PMEIntEna- CRSVisible-
		RootCap: CRSVisible-
		RootSta: PME ReqID 0000, PMEStatus- PMEPending-
		DevCap2: Completion Timeout: Range BC, TimeoutDis+, LTR-, OBFF Not Supported ARIFwd-
		DevCtl2: Completion Timeout: 50us to 50ms, TimeoutDis-, LTR-, OBFF Disabled ARIFwd-
		LnkCtl2: Target Link Speed: 5GT/s, EnterCompliance- SpeedDis-
			 Transmit Margin: Normal Operating Range, EnterModifiedCompliance- ComplianceSOS-
			 Compliance De-emphasis: -6dB
		LnkSta2: Current De-emphasis Level: -3.5dB, EqualizationComplete-, EqualizationPhase1-
			 EqualizationPhase2-, EqualizationPhase3-, LinkEqualizationRequest-
	Capabilities: [80] MSI: Enable- Count=1/1 Maskable- 64bit-
		Address: 00000000  Data: 0000
	Capabilities: [90] Subsystem: ASRock Incorporation Device [1849:0f4e]
	Capabilities: [a0] Power Management version 3
		Flags: PMEClk- DSI- D1- D2- AuxCurrent=0mA PME(D0+,D1-,D2-,D3hot+,D3cold+)
		Status: D0 NoSoftRst- PME-Enable- DSel=0 DScale=0 PME-
	Kernel driver in use: pcieport

00:1f.0 ISA bridge [0601]: Intel Corporation Atom Processor Z36xxx/Z37xxx Series Power Control Unit [8086:0f1c] (rev 0e)
	Subsystem: ASRock Incorporation Device [1849:0f1c]
	Control: I/O+ Mem+ BusMaster+ SpecCycle- MemWINV- VGASnoop- ParErr- Stepping- SERR- FastB2B- DisINTx-
	Status: Cap+ 66MHz- UDF- FastB2B- ParErr- DEVSEL=medium >TAbort- <TAbort- <MAbort- >SERR- <PERR- INTx-
	Latency: 0
	Capabilities: [e0] Vendor Specific Information: Len=0c <?>
	Kernel driver in use: lpc_ich

00:1f.3 SMBus [0c05]: Intel Corporation Atom Processor E3800 Series SMBus Controller [8086:0f12] (rev 0e)
	Subsystem: ASRock Incorporation Device [1849:0f12]
	Control: I/O+ Mem+ BusMaster- SpecCycle- MemWINV- VGASnoop- ParErr- Stepping- SERR- FastB2B- DisINTx-
	Status: Cap+ 66MHz- UDF- FastB2B+ ParErr- DEVSEL=medium >TAbort- <TAbort- <MAbort- >SERR- <PERR- INTx-
	Interrupt: pin B routed to IRQ 11
	Region 0: Memory at d1610000 (32-bit, non-prefetchable) [size=32]
	Region 4: I/O ports at f000 [size=32]
	Capabilities: [50] Power Management version 3
		Flags: PMEClk- DSI- D1- D2- AuxCurrent=0mA PME(D0-,D1-,D2-,D3hot-,D3cold-)
		Status: D0 NoSoftRst+ PME-Enable- DSel=0 DScale=0 PME-

01:00.0 Network controller [0280]: Qualcomm Atheros QCA986x/988x 802.11ac Wireless Network Adapter [168c:003c]
	Control: I/O+ Mem+ BusMaster+ SpecCycle- MemWINV- VGASnoop- ParErr- Stepping- SERR- FastB2B- DisINTx+
	Status: Cap+ 66MHz- UDF- FastB2B- ParErr- DEVSEL=fast >TAbort- <TAbort- <MAbort- >SERR- <PERR- INTx-
	Latency: 0, Cache Line Size: 64 bytes
	Interrupt: pin A routed to IRQ 146
	Region 0: Memory at d1000000 (64-bit, non-prefetchable) [size=2M]
	Expansion ROM at d1200000 [disabled] [size=64K]
	Capabilities: [40] Power Management version 2
		Flags: PMEClk- DSI- D1+ D2+ AuxCurrent=375mA PME(D0+,D1+,D2+,D3hot+,D3cold+)
		Status: D0 NoSoftRst- PME-Enable- DSel=0 DScale=0 PME-
	Capabilities: [50] MSI: Enable+ Count=1/8 Maskable+ 64bit-
		Address: fee0800c  Data: 4158
		Masking: fffefffe  Pending: 00000000
	Capabilities: [70] Express (v2) Endpoint, MSI 00
		DevCap:	MaxPayload 256 bytes, PhantFunc 0, Latency L0s unlimited, L1 <64us
			ExtTag- AttnBtn- AttnInd- PwrInd- RBE+ FLReset-
		DevCtl:	Report errors: Correctable- Non-Fatal- Fatal- Unsupported-
			RlxdOrd- ExtTag- PhantFunc- AuxPwr- NoSnoop-
			MaxPayload 128 bytes, MaxReadReq 512 bytes
		DevSta:	CorrErr+ UncorrErr- FatalErr- UnsuppReq+ AuxPwr+ TransPend-
		LnkCap:	Port #0, Speed 2.5GT/s, Width x1, ASPM L0s L1, Exit Latency L0s <4us, L1 <64us
			ClockPM- Surprise- LLActRep- BwNot-
		LnkCtl:	ASPM Disabled; RCB 64 bytes Disabled- CommClk-
			ExtSynch- ClockPM- AutWidDis- BWInt- AutBWInt-
		LnkSta:	Speed 2.5GT/s, Width x1, TrErr- Train- SlotClk+ DLActive- BWMgmt- ABWMgmt-
		DevCap2: Completion Timeout: Not Supported, TimeoutDis+, LTR-, OBFF Not Supported
		DevCtl2: Completion Timeout: 50us to 50ms, TimeoutDis-, LTR-, OBFF Disabled
		LnkCtl2: Target Link Speed: 2.5GT/s, EnterCompliance- SpeedDis-
			 Transmit Margin: Normal Operating Range, EnterModifiedCompliance- ComplianceSOS-
			 Compliance De-emphasis: -6dB
		LnkSta2: Current De-emphasis Level: -6dB, EqualizationComplete-, EqualizationPhase1-
			 EqualizationPhase2-, EqualizationPhase3-, LinkEqualizationRequest-
	Capabilities: [100 v1] Advanced Error Reporting
		UESta:	DLP- SDES- TLP- FCP- CmpltTO- CmpltAbrt- UnxCmplt- RxOF- MalfTLP- ECRC- UnsupReq- ACSViol-
		UEMsk:	DLP- SDES- TLP- FCP- CmpltTO- CmpltAbrt- UnxCmplt- RxOF- MalfTLP- ECRC- UnsupReq- ACSViol-
		UESvrt:	DLP+ SDES+ TLP- FCP+ CmpltTO- CmpltAbrt- UnxCmplt- RxOF+ MalfTLP+ ECRC- UnsupReq- ACSViol-
		CESta:	RxErr- BadTLP- BadDLLP- Rollover- Timeout- NonFatalErr+
		CEMsk:	RxErr- BadTLP- BadDLLP- Rollover- Timeout- NonFatalErr+
		AERCap:	First Error Pointer: 00, GenCap- CGenEn- ChkCap- ChkEn-
	Capabilities: [140 v1] Virtual Channel
		Caps:	LPEVC=0 RefClk=100ns PATEntryBits=1
		Arb:	Fixed- WRR32- WRR64- WRR128-
		Ctrl:	ArbSelect=Fixed
		Status:	InProgress-
		VC0:	Caps:	PATOffset=00 MaxTimeSlots=1 RejSnoopTrans-
			Arb:	Fixed- WRR32- WRR64- WRR128- TWRR128- WRR256-
			Ctrl:	Enable+ ID=0 ArbSelect=Fixed TC/VC=01
			Status:	NegoPending- InProgress-
	Capabilities: [160 v1] Device Serial Number 00-00-00-00-00-00-00-00
	Kernel driver in use: ath10k_pci

02:00.0 PCI bridge [0604]: Integrated Device Technology, Inc. [IDT] PES12N3A PCI Express Switch [111d:8018] (rev 0e) (prog-if 00 [Normal decode])
	Control: I/O+ Mem+ BusMaster+ SpecCycle- MemWINV- VGASnoop- ParErr- Stepping- SERR- FastB2B- DisINTx-
	Status: Cap+ 66MHz- UDF- FastB2B- ParErr- DEVSEL=fast >TAbort- <TAbort- <MAbort- >SERR- <PERR- INTx-
	Latency: 0, Cache Line Size: 64 bytes
	Bus: primary=02, secondary=03, subordinate=05, sec-latency=0
	I/O behind bridge: 0000c000-0000dfff
	Memory behind bridge: d0400000-d0efffff
	Secondary status: 66MHz- FastB2B- ParErr- DEVSEL=fast >TAbort- <TAbort- <MAbort- <SERR- <PERR-
	BridgeCtl: Parity- SERR- NoISA- VGA- MAbort- >Reset- FastB2B-
		PriDiscTmr- SecDiscTmr- DiscTmrStat- DiscTmrSERREn-
	Capabilities: [40] Express (v1) Upstream Port, MSI 00
		DevCap:	MaxPayload 2048 bytes, PhantFunc 0
			ExtTag+ AttnBtn- AttnInd- PwrInd- RBE+ SlotPowerLimit 10.000W
		DevCtl:	Report errors: Correctable- Non-Fatal- Fatal- Unsupported-
			RlxdOrd- ExtTag- PhantFunc- AuxPwr- NoSnoop-
			MaxPayload 128 bytes, MaxReadReq 128 bytes
		DevSta:	CorrErr+ UncorrErr- FatalErr- UnsuppReq+ AuxPwr- TransPend-
		LnkCap:	Port #0, Speed 2.5GT/s, Width x4, ASPM L0s L1, Exit Latency L0s <512ns, L1 <4us
			ClockPM- Surprise- LLActRep- BwNot-
		LnkCtl:	ASPM Disabled; Disabled- CommClk+
			ExtSynch- ClockPM- AutWidDis- BWInt- AutBWInt-
		LnkSta:	Speed 2.5GT/s, Width x1, TrErr- Train- SlotClk+ DLActive- BWMgmt- ABWMgmt-
	Capabilities: [c0] Power Management version 3
		Flags: PMEClk- DSI- D1- D2- AuxCurrent=0mA PME(D0+,D1-,D2-,D3hot+,D3cold+)
		Status: D0 NoSoftRst+ PME-Enable- DSel=0 DScale=0 PME-
	Capabilities: [100 v1] Advanced Error Reporting
		UESta:	DLP- SDES- TLP- FCP- CmpltTO- CmpltAbrt- UnxCmplt- RxOF- MalfTLP- ECRC- UnsupReq- ACSViol-
		UEMsk:	DLP- SDES- TLP- FCP- CmpltTO- CmpltAbrt- UnxCmplt- RxOF- MalfTLP- ECRC- UnsupReq- ACSViol-
		UESvrt:	DLP+ SDES+ TLP- FCP+ CmpltTO- CmpltAbrt- UnxCmplt- RxOF+ MalfTLP+ ECRC- UnsupReq- ACSViol-
		CESta:	RxErr- BadTLP- BadDLLP- Rollover- Timeout- NonFatalErr+
		CEMsk:	RxErr- BadTLP- BadDLLP- Rollover- Timeout- NonFatalErr+
		AERCap:	First Error Pointer: 00, GenCap+ CGenEn- ChkCap+ ChkEn-
	Capabilities: [200 v1] Virtual Channel
		Caps:	LPEVC=0 RefClk=100ns PATEntryBits=4
		Arb:	Fixed- WRR32- WRR64- WRR128-
		Ctrl:	ArbSelect=Fixed
		Status:	InProgress-
		VC0:	Caps:	PATOffset=02 MaxTimeSlots=1 RejSnoopTrans-
			Arb:	Fixed+ WRR32+ WRR64- WRR128- TWRR128- WRR256-
			Ctrl:	Enable+ ID=0 ArbSelect=Fixed TC/VC=01
			Status:	NegoPending- InProgress-
			Port Arbitration Table <?>
	Kernel driver in use: pcieport

03:02.0 PCI bridge [0604]: Integrated Device Technology, Inc. [IDT] PES12N3A PCI Express Switch [111d:8018] (rev 0e) (prog-if 00 [Normal decode])
	Control: I/O+ Mem+ BusMaster+ SpecCycle- MemWINV- VGASnoop- ParErr- Stepping- SERR- FastB2B- DisINTx+
	Status: Cap+ 66MHz- UDF- FastB2B- ParErr- DEVSEL=fast >TAbort- <TAbort- <MAbort- >SERR- <PERR- INTx-
	Latency: 0, Cache Line Size: 64 bytes
	Bus: primary=03, secondary=04, subordinate=04, sec-latency=0
	I/O behind bridge: 0000d000-0000dfff
	Memory behind bridge: d0a00000-d0efffff
	Secondary status: 66MHz- FastB2B- ParErr- DEVSEL=fast >TAbort- <TAbort- <MAbort- <SERR- <PERR-
	BridgeCtl: Parity- SERR- NoISA- VGA- MAbort- >Reset- FastB2B-
		PriDiscTmr- SecDiscTmr- DiscTmrStat- DiscTmrSERREn-
	Capabilities: [40] Express (v1) Downstream Port (Slot-), MSI 00
		DevCap:	MaxPayload 2048 bytes, PhantFunc 0
			ExtTag+ RBE+
		DevCtl:	Report errors: Correctable- Non-Fatal- Fatal- Unsupported-
			RlxdOrd- ExtTag- PhantFunc- AuxPwr- NoSnoop-
			MaxPayload 128 bytes, MaxReadReq 128 bytes
		DevSta:	CorrErr+ UncorrErr- FatalErr- UnsuppReq+ AuxPwr- TransPend-
		LnkCap:	Port #2, Speed 2.5GT/s, Width x4, ASPM L0s L1, Exit Latency L0s <512ns, L1 <4us
			ClockPM- Surprise+ LLActRep+ BwNot-
		LnkCtl:	ASPM Disabled; Disabled- CommClk+
			ExtSynch- ClockPM- AutWidDis- BWInt- AutBWInt-
		LnkSta:	Speed 2.5GT/s, Width x4, TrErr- Train- SlotClk+ DLActive+ BWMgmt- ABWMgmt-
	Capabilities: [c0] Power Management version 3
		Flags: PMEClk- DSI- D1- D2- AuxCurrent=0mA PME(D0+,D1-,D2-,D3hot+,D3cold+)
		Status: D0 NoSoftRst+ PME-Enable- DSel=0 DScale=0 PME-
	Capabilities: [d0] MSI: Enable+ Count=1/1 Maskable- 64bit+
		Address: 00000000fee0f00c  Data: 4191
	Capabilities: [100 v1] Advanced Error Reporting
		UESta:	DLP- SDES- TLP- FCP- CmpltTO- CmpltAbrt- UnxCmplt- RxOF- MalfTLP- ECRC- UnsupReq- ACSViol-
		UEMsk:	DLP- SDES- TLP- FCP- CmpltTO- CmpltAbrt- UnxCmplt- RxOF- MalfTLP- ECRC- UnsupReq- ACSViol-
		UESvrt:	DLP+ SDES+ TLP- FCP+ CmpltTO- CmpltAbrt- UnxCmplt- RxOF+ MalfTLP+ ECRC- UnsupReq- ACSViol-
		CESta:	RxErr- BadTLP- BadDLLP- Rollover- Timeout- NonFatalErr+
		CEMsk:	RxErr- BadTLP- BadDLLP- Rollover- Timeout- NonFatalErr+
		AERCap:	First Error Pointer: 00, GenCap+ CGenEn- ChkCap+ ChkEn-
	Capabilities: [200 v1] Virtual Channel
		Caps:	LPEVC=0 RefClk=100ns PATEntryBits=1
		Arb:	Fixed- WRR32- WRR64- WRR128-
		Ctrl:	ArbSelect=Fixed
		Status:	InProgress-
		VC0:	Caps:	PATOffset=00 MaxTimeSlots=1 RejSnoopTrans-
			Arb:	Fixed+ WRR32- WRR64- WRR128- TWRR128- WRR256-
			Ctrl:	Enable+ ID=0 ArbSelect=Fixed TC/VC=01
			Status:	NegoPending- InProgress-
	Kernel driver in use: pcieport

03:04.0 PCI bridge [0604]: Integrated Device Technology, Inc. [IDT] PES12N3A PCI Express Switch [111d:8018] (rev 0e) (prog-if 00 [Normal decode])
	Control: I/O+ Mem+ BusMaster+ SpecCycle- MemWINV- VGASnoop- ParErr- Stepping- SERR- FastB2B- DisINTx+
	Status: Cap+ 66MHz- UDF- FastB2B- ParErr- DEVSEL=fast >TAbort- <TAbort- <MAbort- >SERR- <PERR- INTx-
	Latency: 0, Cache Line Size: 64 bytes
	Bus: primary=03, secondary=05, subordinate=05, sec-latency=0
	I/O behind bridge: 0000c000-0000cfff
	Memory behind bridge: d0400000-d08fffff
	Secondary status: 66MHz- FastB2B- ParErr- DEVSEL=fast >TAbort- <TAbort- <MAbort- <SERR- <PERR-
	BridgeCtl: Parity- SERR- NoISA- VGA- MAbort- >Reset- FastB2B-
		PriDiscTmr- SecDiscTmr- DiscTmrStat- DiscTmrSERREn-
	Capabilities: [40] Express (v1) Downstream Port (Slot-), MSI 00
		DevCap:	MaxPayload 2048 bytes, PhantFunc 0
			ExtTag+ RBE+
		DevCtl:	Report errors: Correctable- Non-Fatal- Fatal- Unsupported-
			RlxdOrd- ExtTag- PhantFunc- AuxPwr- NoSnoop-
			MaxPayload 128 bytes, MaxReadReq 128 bytes
		DevSta:	CorrErr+ UncorrErr- FatalErr- UnsuppReq+ AuxPwr- TransPend-
		LnkCap:	Port #4, Speed 2.5GT/s, Width x4, ASPM L0s L1, Exit Latency L0s <512ns, L1 <4us
			ClockPM- Surprise+ LLActRep+ BwNot-
		LnkCtl:	ASPM Disabled; Disabled- CommClk+
			ExtSynch- ClockPM- AutWidDis- BWInt- AutBWInt-
		LnkSta:	Speed 2.5GT/s, Width x4, TrErr- Train- SlotClk+ DLActive+ BWMgmt- ABWMgmt-
	Capabilities: [c0] Power Management version 3
		Flags: PMEClk- DSI- D1- D2- AuxCurrent=0mA PME(D0+,D1-,D2-,D3hot+,D3cold+)
		Status: D0 NoSoftRst+ PME-Enable- DSel=0 DScale=0 PME-
	Capabilities: [d0] MSI: Enable+ Count=1/1 Maskable- 64bit+
		Address: 00000000fee0f00c  Data: 41a1
	Capabilities: [100 v1] Advanced Error Reporting
		UESta:	DLP- SDES- TLP- FCP- CmpltTO- CmpltAbrt- UnxCmplt- RxOF- MalfTLP- ECRC- UnsupReq- ACSViol-
		UEMsk:	DLP- SDES- TLP- FCP- CmpltTO- CmpltAbrt- UnxCmplt- RxOF- MalfTLP- ECRC- UnsupReq- ACSViol-
		UESvrt:	DLP+ SDES+ TLP- FCP+ CmpltTO- CmpltAbrt- UnxCmplt- RxOF+ MalfTLP+ ECRC- UnsupReq- ACSViol-
		CESta:	RxErr- BadTLP- BadDLLP- Rollover- Timeout- NonFatalErr+
		CEMsk:	RxErr- BadTLP- BadDLLP- Rollover- Timeout- NonFatalErr+
		AERCap:	First Error Pointer: 00, GenCap+ CGenEn- ChkCap+ ChkEn-
	Capabilities: [200 v1] Virtual Channel
		Caps:	LPEVC=0 RefClk=100ns PATEntryBits=1
		Arb:	Fixed- WRR32- WRR64- WRR128-
		Ctrl:	ArbSelect=Fixed
		Status:	InProgress-
		VC0:	Caps:	PATOffset=00 MaxTimeSlots=1 RejSnoopTrans-
			Arb:	Fixed+ WRR32- WRR64- WRR128- TWRR128- WRR256-
			Ctrl:	Enable+ ID=0 ArbSelect=Fixed TC/VC=01
			Status:	NegoPending- InProgress-
	Kernel driver in use: pcieport

04:00.0 Ethernet controller [0200]: Intel Corporation 82575GB Gigabit Network Connection [8086:10d6] (rev 02)
	Subsystem: Intel Corporation Gigabit VT Quad Port Server Adapter [8086:145a]
	Control: I/O+ Mem+ BusMaster+ SpecCycle- MemWINV- VGASnoop- ParErr- Stepping- SERR- FastB2B- DisINTx+
	Status: Cap+ 66MHz- UDF- FastB2B- ParErr- DEVSEL=fast >TAbort- <TAbort- <MAbort- >SERR- <PERR- INTx-
	Latency: 0, Cache Line Size: 64 bytes
	Interrupt: pin A routed to IRQ 19
	Region 0: Memory at d0e20000 (32-bit, non-prefetchable) [size=128K]
	Region 1: Memory at d0c00000 (32-bit, non-prefetchable) [size=2M]
	Region 2: I/O ports at d020 [size=32]
	Region 3: Memory at d0e44000 (32-bit, non-prefetchable) [size=16K]
	Capabilities: [40] Power Management version 2
		Flags: PMEClk- DSI+ D1- D2- AuxCurrent=0mA PME(D0-,D1-,D2-,D3hot-,D3cold-)
		Status: D0 NoSoftRst- PME-Enable- DSel=0 DScale=0 PME-
	Capabilities: [50] MSI: Enable- Count=1/1 Maskable- 64bit+
		Address: 0000000000000000  Data: 0000
	Capabilities: [60] MSI-X: Enable+ Count=10 Masked-
		Vector table: BAR=3 offset=00000000
		PBA: BAR=3 offset=00002000
	Capabilities: [a0] Express (v2) Endpoint, MSI 00
		DevCap:	MaxPayload 256 bytes, PhantFunc 0, Latency L0s <512ns, L1 <64us
			ExtTag- AttnBtn- AttnInd- PwrInd- RBE+ FLReset-
		DevCtl:	Report errors: Correctable+ Non-Fatal+ Fatal+ Unsupported+
			RlxdOrd- ExtTag- PhantFunc- AuxPwr- NoSnoop+
			MaxPayload 128 bytes, MaxReadReq 512 bytes
		DevSta:	CorrErr+ UncorrErr- FatalErr- UnsuppReq+ AuxPwr+ TransPend-
		LnkCap:	Port #2, Speed 2.5GT/s, Width x4, ASPM not supported, Exit Latency L0s <4us, L1 <64us
			ClockPM- Surprise- LLActRep- BwNot-
		LnkCtl:	ASPM Disabled; RCB 64 bytes Disabled- CommClk+
			ExtSynch- ClockPM- AutWidDis- BWInt- AutBWInt-
		LnkSta:	Speed 2.5GT/s, Width x4, TrErr- Train- SlotClk+ DLActive- BWMgmt- ABWMgmt-
		DevCap2: Completion Timeout: Range ABCD, TimeoutDis+, LTR-, OBFF Not Supported
		DevCtl2: Completion Timeout: 16ms to 55ms, TimeoutDis-, LTR-, OBFF Disabled
		LnkCtl2: Target Link Speed: 2.5GT/s, EnterCompliance- SpeedDis-
			 Transmit Margin: Normal Operating Range, EnterModifiedCompliance- ComplianceSOS-
			 Compliance De-emphasis: -6dB
		LnkSta2: Current De-emphasis Level: -6dB, EqualizationComplete-, EqualizationPhase1-
			 EqualizationPhase2-, EqualizationPhase3-, LinkEqualizationRequest-
	Capabilities: [100 v1] Advanced Error Reporting
		UESta:	DLP- SDES- TLP- FCP- CmpltTO- CmpltAbrt- UnxCmplt- RxOF- MalfTLP- ECRC- UnsupReq- ACSViol-
		UEMsk:	DLP- SDES- TLP- FCP- CmpltTO- CmpltAbrt- UnxCmplt- RxOF- MalfTLP- ECRC- UnsupReq- ACSViol-
		UESvrt:	DLP+ SDES- TLP- FCP+ CmpltTO- CmpltAbrt- UnxCmplt- RxOF+ MalfTLP+ ECRC- UnsupReq- ACSViol-
		CESta:	RxErr- BadTLP- BadDLLP- Rollover- Timeout- NonFatalErr+
		CEMsk:	RxErr- BadTLP- BadDLLP- Rollover- Timeout- NonFatalErr+
		AERCap:	First Error Pointer: 00, GenCap- CGenEn- ChkCap- ChkEn-
	Capabilities: [140 v1] Device Serial Number 00-1b-21-ff-ff-4a-7b-f8
	Kernel driver in use: igb

04:00.1 Ethernet controller [0200]: Intel Corporation 82575GB Gigabit Network Connection [8086:10d6] (rev 02)
	Subsystem: Intel Corporation Gigabit VT Quad Port Server Adapter [8086:145a]
	Control: I/O+ Mem+ BusMaster+ SpecCycle- MemWINV- VGASnoop- ParErr- Stepping- SERR- FastB2B- DisINTx+
	Status: Cap+ 66MHz- UDF- FastB2B- ParErr- DEVSEL=fast >TAbort- <TAbort- <MAbort- >SERR- <PERR- INTx-
	Latency: 0, Cache Line Size: 64 bytes
	Interrupt: pin B routed to IRQ 16
	Region 0: Memory at d0e00000 (32-bit, non-prefetchable) [size=128K]
	Region 1: Memory at d0a00000 (32-bit, non-prefetchable) [size=2M]
	Region 2: I/O ports at d000 [size=32]
	Region 3: Memory at d0e40000 (32-bit, non-prefetchable) [size=16K]
	Capabilities: [40] Power Management version 2
		Flags: PMEClk- DSI+ D1- D2- AuxCurrent=0mA PME(D0-,D1-,D2-,D3hot-,D3cold-)
		Status: D0 NoSoftRst- PME-Enable- DSel=0 DScale=0 PME-
	Capabilities: [50] MSI: Enable- Count=1/1 Maskable- 64bit+
		Address: 0000000000000000  Data: 0000
	Capabilities: [60] MSI-X: Enable+ Count=10 Masked-
		Vector table: BAR=3 offset=00000000
		PBA: BAR=3 offset=00002000
	Capabilities: [a0] Express (v2) Endpoint, MSI 00
		DevCap:	MaxPayload 256 bytes, PhantFunc 0, Latency L0s <512ns, L1 <64us
			ExtTag- AttnBtn- AttnInd- PwrInd- RBE+ FLReset-
		DevCtl:	Report errors: Correctable+ Non-Fatal+ Fatal+ Unsupported+
			RlxdOrd- ExtTag- PhantFunc- AuxPwr- NoSnoop+
			MaxPayload 128 bytes, MaxReadReq 512 bytes
		DevSta:	CorrErr+ UncorrErr- FatalErr- UnsuppReq+ AuxPwr+ TransPend-
		LnkCap:	Port #2, Speed 2.5GT/s, Width x4, ASPM not supported, Exit Latency L0s <4us, L1 <64us
			ClockPM- Surprise- LLActRep- BwNot-
		LnkCtl:	ASPM Disabled; RCB 64 bytes Disabled- CommClk+
			ExtSynch- ClockPM- AutWidDis- BWInt- AutBWInt-
		LnkSta:	Speed 2.5GT/s, Width x4, TrErr- Train- SlotClk+ DLActive- BWMgmt- ABWMgmt-
		DevCap2: Completion Timeout: Range ABCD, TimeoutDis+, LTR-, OBFF Not Supported
		DevCtl2: Completion Timeout: 16ms to 55ms, TimeoutDis-, LTR-, OBFF Disabled
		LnkSta2: Current De-emphasis Level: -6dB, EqualizationComplete-, EqualizationPhase1-
			 EqualizationPhase2-, EqualizationPhase3-, LinkEqualizationRequest-
	Capabilities: [100 v1] Advanced Error Reporting
		UESta:	DLP- SDES- TLP- FCP- CmpltTO- CmpltAbrt- UnxCmplt- RxOF- MalfTLP- ECRC- UnsupReq- ACSViol-
		UEMsk:	DLP- SDES- TLP- FCP- CmpltTO- CmpltAbrt- UnxCmplt- RxOF- MalfTLP- ECRC- UnsupReq- ACSViol-
		UESvrt:	DLP+ SDES- TLP- FCP+ CmpltTO- CmpltAbrt- UnxCmplt- RxOF+ MalfTLP+ ECRC- UnsupReq- ACSViol-
		CESta:	RxErr- BadTLP- BadDLLP- Rollover- Timeout- NonFatalErr+
		CEMsk:	RxErr- BadTLP- BadDLLP- Rollover- Timeout- NonFatalErr+
		AERCap:	First Error Pointer: 00, GenCap- CGenEn- ChkCap- ChkEn-
	Capabilities: [140 v1] Device Serial Number 00-1b-21-ff-ff-4a-7b-f8
	Kernel driver in use: igb

05:00.0 Ethernet controller [0200]: Intel Corporation 82575GB Gigabit Network Connection [8086:10d6] (rev 02)
	Subsystem: Intel Corporation Gigabit VT Quad Port Server Adapter [8086:145a]
	Control: I/O+ Mem+ BusMaster+ SpecCycle- MemWINV- VGASnoop- ParErr- Stepping- SERR- FastB2B- DisINTx+
	Status: Cap+ 66MHz- UDF- FastB2B- ParErr- DEVSEL=fast >TAbort- <TAbort- <MAbort- >SERR- <PERR- INTx-
	Latency: 0, Cache Line Size: 64 bytes
	Interrupt: pin A routed to IRQ 17
	Region 0: Memory at d0820000 (32-bit, non-prefetchable) [size=128K]
	Region 1: Memory at d0600000 (32-bit, non-prefetchable) [size=2M]
	Region 2: I/O ports at c020 [size=32]
	Region 3: Memory at d0844000 (32-bit, non-prefetchable) [size=16K]
	Capabilities: [40] Power Management version 2
		Flags: PMEClk- DSI+ D1- D2- AuxCurrent=0mA PME(D0-,D1-,D2-,D3hot-,D3cold-)
		Status: D0 NoSoftRst- PME-Enable- DSel=0 DScale=0 PME-
	Capabilities: [50] MSI: Enable- Count=1/1 Maskable- 64bit+
		Address: 0000000000000000  Data: 0000
	Capabilities: [60] MSI-X: Enable+ Count=10 Masked-
		Vector table: BAR=3 offset=00000000
		PBA: BAR=3 offset=00002000
	Capabilities: [a0] Express (v2) Endpoint, MSI 00
		DevCap:	MaxPayload 256 bytes, PhantFunc 0, Latency L0s <512ns, L1 <64us
			ExtTag- AttnBtn- AttnInd- PwrInd- RBE+ FLReset-
		DevCtl:	Report errors: Correctable+ Non-Fatal+ Fatal+ Unsupported+
			RlxdOrd- ExtTag- PhantFunc- AuxPwr- NoSnoop+
			MaxPayload 128 bytes, MaxReadReq 512 bytes
		DevSta:	CorrErr+ UncorrErr- FatalErr- UnsuppReq+ AuxPwr- TransPend-
		LnkCap:	Port #4, Speed 2.5GT/s, Width x4, ASPM not supported, Exit Latency L0s <4us, L1 <64us
			ClockPM- Surprise- LLActRep- BwNot-
		LnkCtl:	ASPM Disabled; RCB 64 bytes Disabled- CommClk+
			ExtSynch- ClockPM- AutWidDis- BWInt- AutBWInt-
		LnkSta:	Speed 2.5GT/s, Width x4, TrErr- Train- SlotClk+ DLActive- BWMgmt- ABWMgmt-
		DevCap2: Completion Timeout: Range ABCD, TimeoutDis+, LTR-, OBFF Not Supported
		DevCtl2: Completion Timeout: 16ms to 55ms, TimeoutDis-, LTR-, OBFF Disabled
		LnkCtl2: Target Link Speed: 2.5GT/s, EnterCompliance- SpeedDis-
			 Transmit Margin: Normal Operating Range, EnterModifiedCompliance- ComplianceSOS-
			 Compliance De-emphasis: -6dB
		LnkSta2: Current De-emphasis Level: -6dB, EqualizationComplete-, EqualizationPhase1-
			 EqualizationPhase2-, EqualizationPhase3-, LinkEqualizationRequest-
	Capabilities: [100 v1] Advanced Error Reporting
		UESta:	DLP- SDES- TLP- FCP- CmpltTO- CmpltAbrt- UnxCmplt- RxOF- MalfTLP- ECRC- UnsupReq- ACSViol-
		UEMsk:	DLP- SDES- TLP- FCP- CmpltTO- CmpltAbrt- UnxCmplt- RxOF- MalfTLP- ECRC- UnsupReq- ACSViol-
		UESvrt:	DLP+ SDES- TLP- FCP+ CmpltTO- CmpltAbrt- UnxCmplt- RxOF+ MalfTLP+ ECRC- UnsupReq- ACSViol-
		CESta:	RxErr- BadTLP- BadDLLP- Rollover- Timeout- NonFatalErr+
		CEMsk:	RxErr- BadTLP- BadDLLP- Rollover- Timeout- NonFatalErr+
		AERCap:	First Error Pointer: 00, GenCap- CGenEn- ChkCap- ChkEn-
	Capabilities: [140 v1] Device Serial Number 00-1b-21-ff-ff-4a-7b-fc
	Kernel driver in use: igb

05:00.1 Ethernet controller [0200]: Intel Corporation 82575GB Gigabit Network Connection [8086:10d6] (rev 02)
	Subsystem: Intel Corporation Gigabit VT Quad Port Server Adapter [8086:145a]
	Control: I/O+ Mem+ BusMaster+ SpecCycle- MemWINV- VGASnoop- ParErr- Stepping- SERR- FastB2B- DisINTx+
	Status: Cap+ 66MHz- UDF- FastB2B- ParErr- DEVSEL=fast >TAbort- <TAbort- <MAbort- >SERR- <PERR- INTx-
	Latency: 0, Cache Line Size: 64 bytes
	Interrupt: pin B routed to IRQ 18
	Region 0: Memory at d0800000 (32-bit, non-prefetchable) [size=128K]
	Region 1: Memory at d0400000 (32-bit, non-prefetchable) [size=2M]
	Region 2: I/O ports at c000 [size=32]
	Region 3: Memory at d0840000 (32-bit, non-prefetchable) [size=16K]
	Capabilities: [40] Power Management version 2
		Flags: PMEClk- DSI+ D1- D2- AuxCurrent=0mA PME(D0-,D1-,D2-,D3hot-,D3cold-)
		Status: D0 NoSoftRst- PME-Enable- DSel=0 DScale=0 PME-
	Capabilities: [50] MSI: Enable- Count=1/1 Maskable- 64bit+
		Address: 0000000000000000  Data: 0000
	Capabilities: [60] MSI-X: Enable+ Count=10 Masked-
		Vector table: BAR=3 offset=00000000
		PBA: BAR=3 offset=00002000
	Capabilities: [a0] Express (v2) Endpoint, MSI 00
		DevCap:	MaxPayload 256 bytes, PhantFunc 0, Latency L0s <512ns, L1 <64us
			ExtTag- AttnBtn- AttnInd- PwrInd- RBE+ FLReset-
		DevCtl:	Report errors: Correctable+ Non-Fatal+ Fatal+ Unsupported+
			RlxdOrd- ExtTag- PhantFunc- AuxPwr- NoSnoop+
			MaxPayload 128 bytes, MaxReadReq 512 bytes
		DevSta:	CorrErr+ UncorrErr- FatalErr- UnsuppReq+ AuxPwr- TransPend-
		LnkCap:	Port #4, Speed 2.5GT/s, Width x4, ASPM not supported, Exit Latency L0s <4us, L1 <64us
			ClockPM- Surprise- LLActRep- BwNot-
		LnkCtl:	ASPM Disabled; RCB 64 bytes Disabled- CommClk+
			ExtSynch- ClockPM- AutWidDis- BWInt- AutBWInt-
		LnkSta:	Speed 2.5GT/s, Width x4, TrErr- Train- SlotClk+ DLActive- BWMgmt- ABWMgmt-
		DevCap2: Completion Timeout: Range ABCD, TimeoutDis+, LTR-, OBFF Not Supported
		DevCtl2: Completion Timeout: 16ms to 55ms, TimeoutDis-, LTR-, OBFF Disabled
		LnkSta2: Current De-emphasis Level: -6dB, EqualizationComplete-, EqualizationPhase1-
			 EqualizationPhase2-, EqualizationPhase3-, LinkEqualizationRequest-
	Capabilities: [100 v1] Advanced Error Reporting
		UESta:	DLP- SDES- TLP- FCP- CmpltTO- CmpltAbrt- UnxCmplt- RxOF- MalfTLP- ECRC- UnsupReq- ACSViol-
		UEMsk:	DLP- SDES- TLP- FCP- CmpltTO- CmpltAbrt- UnxCmplt- RxOF- MalfTLP- ECRC- UnsupReq- ACSViol-
		UESvrt:	DLP+ SDES- TLP- FCP+ CmpltTO- CmpltAbrt- UnxCmplt- RxOF+ MalfTLP+ ECRC- UnsupReq- ACSViol-
		CESta:	RxErr- BadTLP- BadDLLP- Rollover- Timeout- NonFatalErr+
		CEMsk:	RxErr- BadTLP- BadDLLP- Rollover- Timeout- NonFatalErr+
		AERCap:	First Error Pointer: 00, GenCap- CGenEn- ChkCap- ChkEn-
	Capabilities: [140 v1] Device Serial Number 00-1b-21-ff-ff-4a-7b-fc
	Kernel driver in use: igb

06:00.0 Network controller [0280]: Qualcomm Atheros AR93xx Wireless Network Adapter [168c:0030] (rev 01)
	Subsystem: Apple Inc. AirPort Extreme [106b:009a]
	Control: I/O+ Mem+ BusMaster+ SpecCycle- MemWINV- VGASnoop- ParErr- Stepping- SERR- FastB2B- DisINTx-
	Status: Cap+ 66MHz- UDF- FastB2B- ParErr- DEVSEL=fast >TAbort- <TAbort- <MAbort- >SERR- <PERR- INTx-
	Latency: 0, Cache Line Size: 64 bytes
	Interrupt: pin A routed to IRQ 18
	Region 0: Memory at d1500000 (64-bit, non-prefetchable) [size=128K]
	Expansion ROM at d1520000 [disabled] [size=64K]
	Capabilities: [40] Power Management version 2
		Flags: PMEClk- DSI- D1+ D2+ AuxCurrent=375mA PME(D0+,D1+,D2+,D3hot+,D3cold+)
		Status: D0 NoSoftRst- PME-Enable- DSel=0 DScale=0 PME-
	Capabilities: [50] MSI: Enable- Count=1/4 Maskable+ 64bit+
		Address: 0000000000000000  Data: 0000
		Masking: 00000000  Pending: 00000000
	Capabilities: [70] Express (v2) Endpoint, MSI 00
		DevCap:	MaxPayload 128 bytes, PhantFunc 0, Latency L0s <1us, L1 <8us
			ExtTag- AttnBtn- AttnInd- PwrInd- RBE+ FLReset-
		DevCtl:	Report errors: Correctable- Non-Fatal- Fatal- Unsupported-
			RlxdOrd- ExtTag- PhantFunc- AuxPwr- NoSnoop-
			MaxPayload 128 bytes, MaxReadReq 512 bytes
		DevSta:	CorrErr+ UncorrErr- FatalErr- UnsuppReq+ AuxPwr+ TransPend-
		LnkCap:	Port #0, Speed 2.5GT/s, Width x1, ASPM L0s L1, Exit Latency L0s <2us, L1 <64us
			ClockPM- Surprise- LLActRep- BwNot-
		LnkCtl:	ASPM Disabled; RCB 64 bytes Disabled- CommClk+
			ExtSynch- ClockPM- AutWidDis- BWInt- AutBWInt-
		LnkSta:	Speed 2.5GT/s, Width x1, TrErr- Train- SlotClk+ DLActive- BWMgmt- ABWMgmt-
		DevCap2: Completion Timeout: Not Supported, TimeoutDis+, LTR-, OBFF Not Supported
		DevCtl2: Completion Timeout: 50us to 50ms, TimeoutDis-, LTR-, OBFF Disabled
		LnkCtl2: Target Link Speed: 2.5GT/s, EnterCompliance- SpeedDis-
			 Transmit Margin: Normal Operating Range, EnterModifiedCompliance- ComplianceSOS-
			 Compliance De-emphasis: -6dB
		LnkSta2: Current De-emphasis Level: -6dB, EqualizationComplete-, EqualizationPhase1-
			 EqualizationPhase2-, EqualizationPhase3-, LinkEqualizationRequest-
	Capabilities: [100 v1] Advanced Error Reporting
		UESta:	DLP- SDES- TLP- FCP- CmpltTO- CmpltAbrt- UnxCmplt- RxOF- MalfTLP- ECRC- UnsupReq- ACSViol-
		UEMsk:	DLP- SDES- TLP- FCP- CmpltTO- CmpltAbrt- UnxCmplt- RxOF- MalfTLP- ECRC- UnsupReq- ACSViol-
		UESvrt:	DLP+ SDES+ TLP- FCP+ CmpltTO- CmpltAbrt- UnxCmplt- RxOF+ MalfTLP+ ECRC- UnsupReq- ACSViol-
		CESta:	RxErr- BadTLP- BadDLLP- Rollover- Timeout- NonFatalErr+
		CEMsk:	RxErr- BadTLP- BadDLLP- Rollover- Timeout- NonFatalErr+
		AERCap:	First Error Pointer: 00, GenCap- CGenEn- ChkCap- ChkEn-
	Capabilities: [140 v1] Virtual Channel
		Caps:	LPEVC=0 RefClk=100ns PATEntryBits=1
		Arb:	Fixed- WRR32- WRR64- WRR128-
		Ctrl:	ArbSelect=Fixed
		Status:	InProgress-
		VC0:	Caps:	PATOffset=00 MaxTimeSlots=1 RejSnoopTrans-
			Arb:	Fixed- WRR32- WRR64- WRR128- TWRR128- WRR256-
			Ctrl:	Enable+ ID=0 ArbSelect=Fixed TC/VC=01
			Status:	NegoPending- InProgress-
	Capabilities: [300 v1] Device Serial Number 00-00-00-00-00-00-00-00
	Kernel driver in use: ath9k

07:00.0 Ethernet controller [0200]: Realtek Semiconductor Co., Ltd. RTL8111/8168/8411 PCI Express Gigabit Ethernet Controller [10ec:8168] (rev 11)
	Subsystem: ASRock Incorporation Motherboard (one of many) [1849:8168]
	Control: I/O+ Mem+ BusMaster+ SpecCycle- MemWINV- VGASnoop- ParErr- Stepping- SERR- FastB2B- DisINTx+
	Status: Cap+ 66MHz- UDF- FastB2B- ParErr- DEVSEL=fast >TAbort- <TAbort- <MAbort- >SERR- <PERR- INTx-
	Latency: 0, Cache Line Size: 64 bytes
	Interrupt: pin A routed to IRQ 116
	Region 0: I/O ports at e000 [size=256]
	Region 2: Memory at d1404000 (64-bit, non-prefetchable) [size=4K]
	Region 4: Memory at d1400000 (64-bit, prefetchable) [size=16K]
	Capabilities: [40] Power Management version 3
		Flags: PMEClk- DSI- D1+ D2+ AuxCurrent=375mA PME(D0+,D1+,D2+,D3hot+,D3cold+)
		Status: D0 NoSoftRst+ PME-Enable- DSel=0 DScale=0 PME-
	Capabilities: [50] MSI: Enable+ Count=1/1 Maskable- 64bit+
		Address: 00000000fee0400c  Data: 41a2
	Capabilities: [70] Express (v2) Endpoint, MSI 01
		DevCap:	MaxPayload 128 bytes, PhantFunc 0, Latency L0s <512ns, L1 <64us
			ExtTag- AttnBtn- AttnInd- PwrInd- RBE+ FLReset-
		DevCtl:	Report errors: Correctable- Non-Fatal- Fatal- Unsupported-
			RlxdOrd- ExtTag- PhantFunc- AuxPwr- NoSnoop-
			MaxPayload 128 bytes, MaxReadReq 4096 bytes
		DevSta:	CorrErr+ UncorrErr- FatalErr- UnsuppReq+ AuxPwr+ TransPend-
		LnkCap:	Port #0, Speed 2.5GT/s, Width x1, ASPM L0s L1, Exit Latency L0s unlimited, L1 <64us
			ClockPM+ Surprise- LLActRep- BwNot-
		LnkCtl:	ASPM Disabled; RCB 64 bytes Disabled- CommClk+
			ExtSynch- ClockPM+ AutWidDis- BWInt- AutBWInt-
		LnkSta:	Speed 2.5GT/s, Width x1, TrErr- Train- SlotClk+ DLActive- BWMgmt- ABWMgmt-
		DevCap2: Completion Timeout: Range ABCD, TimeoutDis+, LTR+, OBFF Via message/WAKE#
		DevCtl2: Completion Timeout: 50us to 50ms, TimeoutDis-, LTR+, OBFF Disabled
		LnkCtl2: Target Link Speed: 2.5GT/s, EnterCompliance- SpeedDis-
			 Transmit Margin: Normal Operating Range, EnterModifiedCompliance- ComplianceSOS-
			 Compliance De-emphasis: -6dB
		LnkSta2: Current De-emphasis Level: -6dB, EqualizationComplete-, EqualizationPhase1-
			 EqualizationPhase2-, EqualizationPhase3-, LinkEqualizationRequest-
	Capabilities: [b0] MSI-X: Enable- Count=4 Masked-
		Vector table: BAR=4 offset=00000000
		PBA: BAR=4 offset=00000800
	Capabilities: [d0] Vital Product Data
		Unknown small resource type 00, will not decode more.
	Capabilities: [100 v1] Advanced Error Reporting
		UESta:	DLP- SDES- TLP- FCP- CmpltTO- CmpltAbrt- UnxCmplt- RxOF- MalfTLP- ECRC- UnsupReq- ACSViol-
		UEMsk:	DLP- SDES- TLP- FCP- CmpltTO- CmpltAbrt- UnxCmplt- RxOF- MalfTLP- ECRC- UnsupReq- ACSViol-
		UESvrt:	DLP+ SDES+ TLP- FCP+ CmpltTO- CmpltAbrt- UnxCmplt- RxOF+ MalfTLP+ ECRC- UnsupReq- ACSViol-
		CESta:	RxErr- BadTLP- BadDLLP- Rollover- Timeout- NonFatalErr+
		CEMsk:	RxErr- BadTLP- BadDLLP- Rollover- Timeout- NonFatalErr+
		AERCap:	First Error Pointer: 00, GenCap+ CGenEn- ChkCap+ ChkEn-
	Capabilities: [140 v1] Virtual Channel
		Caps:	LPEVC=0 RefClk=100ns PATEntryBits=1
		Arb:	Fixed- WRR32- WRR64- WRR128-
		Ctrl:	ArbSelect=Fixed
		Status:	InProgress-
		VC0:	Caps:	PATOffset=00 MaxTimeSlots=1 RejSnoopTrans-
			Arb:	Fixed- WRR32- WRR64- WRR128- TWRR128- WRR256-
			Ctrl:	Enable+ ID=0 ArbSelect=Fixed TC/VC=01
			Status:	NegoPending- InProgress-
	Capabilities: [160 v1] Device Serial Number 01-00-00-00-68-4c-e0-00
	Capabilities: [170 v1] Latency Tolerance Reporting
		Max snoop latency: 71680ns
		Max no snoop latency: 71680ns
	Kernel driver in use: r8169


brad@Q2900M:~$ sudo lshw -sanitize
computer
    description: Desktop Computer
    product: To Be Filled By O.E.M. (To Be Filled By O.E.M.)
    vendor: To Be Filled By O.E.M.
    version: To Be Filled By O.E.M.
    serial: [REMOVED]
    width: 64 bits
    capabilities: smbios-2.8 dmi-2.7 vsyscall32
    configuration: boot=normal chassis=desktop family=To Be Filled By O.E.M. sku=To Be Filled By O.E.M. uuid=[REMOVED]
  *-core
       description: Motherboard
       product: Q2900M
       vendor: ASRock
       physical id: 0
       serial: [REMOVED]
     *-firmware
          description: BIOS
          vendor: American Megatrends Inc.
          physical id: 0
          version: P1.20
          date: 10/31/2014
          size: 64KiB
          capacity: 8128KiB
          capabilities: pci upgrade shadowing cdboot bootselect socketedrom edd int13floppy1200 int13floppy720 int13floppy2880 int5printscreen int9keyboard int14serial int17printer acpi usb biosbootspecification uefi
     *-memory
          description: System Memory
          physical id: c
          slot: System board or motherboard
          size: 8GiB
        *-bank:0
             description: DIMM DDR3 1333 MHz (0.8 ns)
             product: PSD38G13332
             vendor: Undefined
             physical id: 0
             serial: [REMOVED]
             slot: A1_DIMM0
             size: 8GiB
             width: 64 bits
             clock: 1333MHz (0.8ns)
        *-bank:1
             description: DIMM [empty]
             product: Array1_PartNumber1
             vendor: A1_Manufacturer1
             physical id: 1
             serial: [REMOVED]
             slot: A1_DIMM1
     *-cache:0
          description: L1 cache
          physical id: 13
          slot: CPU Internal L1
          size: 224KiB
          capacity: 224KiB
          capabilities: internal write-back
     *-cache:1
          description: L2 cache
          physical id: 14
          slot: CPU Internal L2
          size: 2MiB
          capacity: 2MiB
          capabilities: internal write-back unified
     *-cpu
          description: CPU
          product: Intel(R) Pentium(R) CPU  J2900  @ 2.41GHz
          vendor: Intel Corp.
          physical id: 15
          bus info: cpu@0
          version: Intel(R) Pentium(R) CPU J2900 @ 2.41GHz
          slot: CPUSocket
          size: 2665MHz
          capacity: 2665MHz
          width: 64 bits
          clock: 83MHz
          capabilities: x86-64 fpu fpu_exception wp vme de pse tsc msr pae mce cx8 apic sep mtrr pge mca cmov pat pse36 clflush dts acpi mmx fxsr sse sse2 ss ht tm pbe syscall nx rdtscp constant_tsc arch_perfmon pebs bts rep_good nopl xtopology nonstop_tsc aperfmperf pni pclmulqdq dtes64 monitor ds_cpl vmx est tm2 ssse3 cx16 xtpr pdcm sse4_1 sse4_2 movbe popcnt tsc_deadline_timer rdrand lahf_lm 3dnowprefetch ida arat epb dtherm tpr_shadow vnmi flexpriority ept vpid tsc_adjust smep erms cpufreq
          configuration: cores=4 enabledcores=4 threads=4
     *-pci
          description: Host bridge
          product: Atom Processor Z36xxx/Z37xxx Series SoC Transaction Register
          vendor: Intel Corporation
          physical id: 100
          bus info: pci@0000:00:00.0
          version: 0e
          width: 32 bits
          clock: 33MHz
          configuration: driver=iosf_mbi_pci
          resources: irq:0
        *-display
             description: VGA compatible controller
             product: Atom Processor Z36xxx/Z37xxx Series Graphics & Display
             vendor: Intel Corporation
             physical id: 2
             bus info: pci@0000:00:02.0
             version: 0e
             width: 32 bits
             clock: 33MHz
             capabilities: pm msi vga_controller bus_master cap_list rom
             configuration: driver=i915 latency=0
             resources: irq:117 memory:d0000000-d03fffff memory:c0000000-cfffffff ioport:f080(size=8)
        *-storage
             description: SATA controller
             product: Atom Processor E3800 Series SATA AHCI Controller
             vendor: Intel Corporation
             physical id: 13
             bus info: pci@0000:00:13.0
             version: 0e
             width: 32 bits
             clock: 66MHz
             capabilities: storage msi pm ahci_1.0 bus_master cap_list
             configuration: driver=ahci latency=0
             resources: irq:106 ioport:f070(size=8) ioport:f060(size=4) ioport:f050(size=8) ioport:f040(size=4) ioport:f020(size=32) memory:d1612000-d16127ff
        *-usb
             description: USB controller
             product: Atom Processor Z36xxx/Z37xxx Series USB xHCI
             vendor: Intel Corporation
             physical id: 14
             bus info: pci@0000:00:14.0
             version: 0e
             width: 64 bits
             clock: 33MHz
             capabilities: pm msi xhci bus_master cap_list
             configuration: driver=xhci_hcd latency=0
             resources: irq:105 memory:d1600000-d160ffff
        *-generic
             description: Encryption controller
             product: Atom Processor Z36xxx/Z37xxx Series Trusted Execution Engine
             vendor: Intel Corporation
             physical id: 1a
             bus info: pci@0000:00:1a.0
             version: 0e
             width: 32 bits
             clock: 33MHz
             capabilities: pm msi bus_master cap_list
             configuration: driver=mei_txe latency=0
             resources: irq:145 memory:d1300000-d13fffff memory:d0f00000-d0ffffff
        *-pci:0
             description: PCI bridge
             product: Atom Processor E3800 Series PCI Express Root Port 1
             vendor: Intel Corporation
             physical id: 1c
             bus info: pci@0000:00:1c.0
             version: 0e
             width: 32 bits
             clock: 33MHz
             capabilities: pci pciexpress msi pm normal_decode bus_master cap_list
             configuration: driver=pcieport
             resources: irq:16 ioport:1000(size=4096) memory:d1000000-d12fffff
           *-network
                description: Wireless interface
                product: QCA986x/988x 802.11ac Wireless Network Adapter
                vendor: Qualcomm Atheros
                physical id: 0
                bus info: pci@0000:01:00.0
                logical name: wlan4
                version: 00
                serial: [REMOVED]
                width: 64 bits
                clock: 33MHz
                capabilities: pm msi pciexpress bus_master cap_list rom ethernet physical wireless
                configuration: broadcast=yes driver=ath10k_pci driverversion=3.16.0-44-generic firmware=1.0.0.636 latency=0 link=no multicast=yes wireless=IEEE 802.11abgn
                resources: irq:146 memory:d1000000-d11fffff memory:d1200000-d120ffff
        *-pci:1
             description: PCI bridge
             product: Atom Processor E3800 Series PCI Express Root Port 2
             vendor: Intel Corporation
             physical id: 1c.1
             bus info: pci@0000:00:1c.1
             version: 0e
             width: 32 bits
             clock: 33MHz
             capabilities: pci pciexpress msi pm normal_decode bus_master cap_list
             configuration: driver=pcieport
             resources: irq:17 ioport:c000(size=8192) memory:d0400000-d0efffff
           *-pci
                description: PCI bridge
                product: PES12N3A PCI Express Switch
                vendor: Integrated Device Technology, Inc. [IDT]
                physical id: 0
                bus info: pci@0000:02:00.0
                version: 0e
                width: 32 bits
                clock: 33MHz
                capabilities: pci pciexpress pm normal_decode bus_master cap_list
                configuration: driver=pcieport
                resources: irq:0 ioport:c000(size=8192) memory:d0400000-d0efffff
              *-pci:0
                   description: PCI bridge
                   product: PES12N3A PCI Express Switch
                   vendor: Integrated Device Technology, Inc. [IDT]
                   physical id: 2
                   bus info: pci@0000:03:02.0
                   version: 0e
                   width: 32 bits
                   clock: 33MHz
                   capabilities: pci pciexpress pm msi normal_decode bus_master cap_list
                   configuration: driver=pcieport
                   resources: irq:103 ioport:d000(size=4096) memory:d0a00000-d0efffff
                 *-network:0
                      description: Ethernet interface
                      product: 82575GB Gigabit Network Connection
                      vendor: Intel Corporation
                      physical id: 0
                      bus info: pci@0000:04:00.0
                      logical name: eth1
                      version: 02
                      serial: [REMOVED]
                      capacity: 1Gbit/s
                      width: 32 bits
                      clock: 33MHz
                      capabilities: pm msi msix pciexpress bus_master cap_list ethernet physical tp 10bt 10bt-fd 100bt 100bt-fd 1000bt-fd autonegotiation
                      configuration: autonegotiation=on broadcast=yes driver=igb driverversion=5.2.13-k firmware=1.77, 0x880c0000 latency=0 link=no multicast=yes port=twisted pair
                      resources: irq:19 memory:d0e20000-d0e3ffff memory:d0c00000-d0dfffff ioport:d020(size=32) memory:d0e44000-d0e47fff
                 *-network:1
                      description: Ethernet interface
                      product: 82575GB Gigabit Network Connection
                      vendor: Intel Corporation
                      physical id: 0.1
                      bus info: pci@0000:04:00.1
                      logical name: eth2
                      version: 02
                      serial: [REMOVED]
                      capacity: 1Gbit/s
                      width: 32 bits
                      clock: 33MHz
                      capabilities: pm msi msix pciexpress bus_master cap_list ethernet physical tp 10bt 10bt-fd 100bt 100bt-fd 1000bt-fd autonegotiation
                      configuration: autonegotiation=on broadcast=yes driver=igb driverversion=5.2.13-k firmware=1.77, 0x880c0000 latency=0 link=no multicast=yes port=twisted pair
                      resources: irq:16 memory:d0e00000-d0e1ffff memory:d0a00000-d0bfffff ioport:d000(size=32) memory:d0e40000-d0e43fff
              *-pci:1
                   description: PCI bridge
                   product: PES12N3A PCI Express Switch
                   vendor: Integrated Device Technology, Inc. [IDT]
                   physical id: 4
                   bus info: pci@0000:03:04.0
                   version: 0e
                   width: 32 bits
                   clock: 33MHz
                   capabilities: pci pciexpress pm msi normal_decode bus_master cap_list
                   configuration: driver=pcieport
                   resources: irq:104 ioport:c000(size=4096) memory:d0400000-d08fffff
                 *-network:0
                      description: Ethernet interface
                      product: 82575GB Gigabit Network Connection
                      vendor: Intel Corporation
                      physical id: 0
                      bus info: pci@0000:05:00.0
                      logical name: eth3
                      version: 02
                      serial: [REMOVED]
                      capacity: 1Gbit/s
                      width: 32 bits
                      clock: 33MHz
                      capabilities: pm msi msix pciexpress bus_master cap_list ethernet physical tp 10bt 10bt-fd 100bt 100bt-fd 1000bt-fd autonegotiation
                      configuration: autonegotiation=on broadcast=yes driver=igb driverversion=5.2.13-k firmware=1.77, 0x880e0000 latency=0 link=no multicast=yes port=twisted pair
                      resources: irq:17 memory:d0820000-d083ffff memory:d0600000-d07fffff ioport:c020(size=32) memory:d0844000-d0847fff
                 *-network:1
                      description: Ethernet interface
                      product: 82575GB Gigabit Network Connection
                      vendor: Intel Corporation
                      physical id: 0.1
                      bus info: pci@0000:05:00.1
                      logical name: eth4
                      version: 02
                      serial: [REMOVED]
                      capacity: 1Gbit/s
                      width: 32 bits
                      clock: 33MHz
                      capabilities: pm msi msix pciexpress bus_master cap_list ethernet physical tp 10bt 10bt-fd 100bt 100bt-fd 1000bt-fd autonegotiation
                      configuration: autonegotiation=on broadcast=yes driver=igb driverversion=5.2.13-k firmware=1.77, 0x880e0000 latency=0 link=no multicast=yes port=twisted pair
                      resources: irq:18 memory:d0800000-d081ffff memory:d0400000-d05fffff ioport:c000(size=32) memory:d0840000-d0843fff
        *-pci:2
             description: PCI bridge
             product: Atom Processor E3800 Series PCI Express Root Port 3
             vendor: Intel Corporation
             physical id: 1c.2
             bus info: pci@0000:00:1c.2
             version: 0e
             width: 32 bits
             clock: 33MHz
             capabilities: pci pciexpress msi pm normal_decode bus_master cap_list
             configuration: driver=pcieport
             resources: irq:18 ioport:2000(size=4096) memory:d1500000-d15fffff
           *-network
                description: Wireless interface
                product: AR93xx Wireless Network Adapter
                vendor: Qualcomm Atheros
                physical id: 0
                bus info: pci@0000:06:00.0
                logical name: wlan0
                version: 01
                serial: [REMOVED]
                width: 64 bits
                clock: 33MHz
                capabilities: pm msi pciexpress bus_master cap_list rom ethernet physical wireless
                configuration: broadcast=yes driver=ath9k driverversion=3.16.0-44-generic firmware=N/A latency=0 link=no multicast=yes wireless=IEEE 802.11abgn
                resources: irq:18 memory:d1500000-d151ffff memory:d1520000-d152ffff
        *-pci:3
             description: PCI bridge
             product: Atom Processor E3800 Series PCI Express Root Port 4
             vendor: Intel Corporation
             physical id: 1c.3
             bus info: pci@0000:00:1c.3
             version: 0e
             width: 32 bits
             clock: 33MHz
             capabilities: pci pciexpress msi pm normal_decode bus_master cap_list
             configuration: driver=pcieport
             resources: irq:19 ioport:e000(size=4096) memory:d1400000-d14fffff
           *-network
                description: Ethernet interface
                product: RTL8111/8168/8411 PCI Express Gigabit Ethernet Controller
                vendor: Realtek Semiconductor Co., Ltd.
                physical id: 0
                bus info: pci@0000:07:00.0
                logical name: eth0
                version: 11
                serial: [REMOVED]
                size: 1Gbit/s
                capacity: 1Gbit/s
                width: 64 bits
                clock: 33MHz
                capabilities: pm msi pciexpress msix vpd bus_master cap_list ethernet physical tp mii 10bt 10bt-fd 100bt 100bt-fd 1000bt 1000bt-fd autonegotiation
                configuration: autonegotiation=on broadcast=yes driver=r8169 driverversion=2.3LK-NAPI duplex=full firmware=rtl8168g-2_0.0.1 02/06/13 ip=[REMOVED] latency=0 link=yes multicast=yes port=MII speed=1Gbit/s
                resources: irq:116 ioport:e000(size=256) memory:d1404000-d1404fff memory:d1400000-d1403fff
        *-isa
             description: ISA bridge
             product: Atom Processor Z36xxx/Z37xxx Series Power Control Unit
             vendor: Intel Corporation
             physical id: 1f
             bus info: pci@0000:00:1f.0
             version: 0e
             width: 32 bits
             clock: 33MHz
             capabilities: isa bus_master cap_list
             configuration: driver=lpc_ich latency=0
             resources: irq:0
        *-serial UNCLAIMED
             description: SMBus
             product: Atom Processor E3800 Series SMBus Controller
             vendor: Intel Corporation
             physical id: 1f.3
             bus info: pci@0000:00:1f.3
             version: 0e
             width: 32 bits
             clock: 33MHz
             capabilities: pm cap_list
             configuration: latency=0
             resources: memory:d1610000-d161001f ioport:f000(size=32)
     *-scsi
          physical id: 1
          logical name: scsi0
          capabilities: emulated
        *-disk
             description: ATA Disk
             product: SSD2SC120G3LA726
             physical id: 0.0.0
             bus info: scsi@0:0.0.0
             logical name: /dev/sda
             version: BBF0
             serial: [REMOVED]
             size: 111GiB (120GB)
             capabilities: partitioned partitioned:dos
             configuration: ansiversion=5 sectorsize=512 signature=895b24ea
           *-volume:0
                description: EXT4 volume
                vendor: Linux
                physical id: 1
                bus info: scsi@0:0.0.0,1
                logical name: /dev/sda1
                logical name: /
                version: 1.0
                serial: [REMOVED]
                size: 103GiB
                capacity: 103GiB
                capabilities: primary bootable journaled extended_attributes large_files huge_files dir_nlink recover extents ext4 ext2 initialized
                configuration: created=2015-08-13 03:49:51 filesystem=ext4 lastmountpoint=/ modified=2015-09-12 15:53:07 mount.fstype=ext4 mount.options=rw,relatime,errors=remount-ro,data=ordered mounted=2015-09-12 15:53:07 state=mounted
           *-volume:1
                description: Extended partition
                physical id: 2
                bus info: scsi@0:0.0.0,2
                logical name: /dev/sda2
                size: 8084MiB
                capacity: 8084MiB
                capabilities: primary extended partitioned partitioned:extended
              *-logicalvolume
                   description: Linux swap / Solaris partition
                   physical id: 5
                   logical name: /dev/sda5
                   capacity: 8084MiB
                   capabilities: nofs
